date,type,author,title,path,datetime,URL,tag
06/10/25,"Circolari, linee guida",,DECRETO 9 settembre 2025 (GU Serie Generale n.232 del 06-10-2025),null,2025-10-06,https://italiadomani.gov.it,
06/10/25,"Circolari, linee guida",,DECRETO 9 settembre 2025 (GU Serie Generale n.232 del 06-10-2025),null,2025-10-06,https://italiadomani.gov.it,
22/09/25,"Circolari, linee guida",,"Circolare del 19 settembre 2025, n. 22",null,2025-09-22,https://italiadomani.gov.it,
22/09/25,"Circolari, linee guida",,"Circolare del 19 settembre 2025, n. 22",null,2025-09-22,https://italiadomani.gov.it,
08/09/25,"Circolari, linee guida",Italia,Cumulo di aiuti e doppio finanziamento - ambito PNRR,null,2025-09-08,https://italiadomani.gov.it,
08/09/25,"Circolari, linee guida",Italia,Cumulo di aiuti e doppio finanziamento - ambito PNRR,null,2025-09-08,https://italiadomani.gov.it,
08/09/25,"Circolari, linee guida",,Cumulo di aiuti e doppio finanziamento - ambito PNRR,null,2025-09-08,https://italiadomani.gov.it,
04/09/25,Italia,,VADEMECUM DNSH DI IFEL,null,2025-09-04,https://italiadomani.gov.it,
04/09/25,Italia,,VADEMECUM DNSH DI IFEL,null,2025-09-04,https://italiadomani.gov.it,
04/09/25,"Circolari, linee guida",Italia,VADEMECUM DNSH DI IFEL,null,2025-09-04,https://italiadomani.gov.it,
04/09/25,"Circolari, linee guida",,VADEMECUM DNSH DI IFEL,null,2025-09-04,https://italiadomani.gov.it,
19/08/25,Italia,,Raccolta normativa PNRR,null,2025-08-19,https://italiadomani.gov.it,
19/08/25,Italia,,Raccolta normativa PNRR,null,2025-08-19,https://italiadomani.gov.it,
19/08/25,"Circolari, linee guida",Italia,Raccolta normativa PNRR,null,2025-08-19,https://italiadomani.gov.it,
10/07/25,Italia,,Quadri sinottici delle Misure del PNRR del Ministero del Lavoro e delle Politiche Sociali,null,2025-07-10,https://italiadomani.gov.it,
10/07/25,"Circolari, linee guida, Leggi, decreti legislativi e decreti-legge",Italia,Quadri sinottici delle Misure del PNRR del Ministero del Lavoro e delle Politiche Sociali,null,2025-07-10,https://italiadomani.gov.it,
10/07/25,Italia,,Quadri sinottici delle Misure del PNRR del Ministero del Lavoro e delle Politiche Sociali,null,2025-07-10,https://italiadomani.gov.it,
10/07/25,Italia,,Quadri sinottici delle Misure del PNRR del Ministero dell'Ambiente e della Sicurezza Energetica,null,2025-07-10,https://italiadomani.gov.it,
10/07/25,Italia,,Quadri sinottici delle Misure del PNRR del Ministero dell'Ambiente e della Sicurezza Energetica,null,2025-07-10,https://italiadomani.gov.it,
10/07/25,Italia,,Quadri sinottici delle Misure del PNRR del Ministero della Cultura,null,2025-07-10,https://italiadomani.gov.it,
10/07/25,Italia,,Quadri sinottici delle Misure del PNRR del Ministero della Cultura,null,2025-07-10,https://italiadomani.gov.it,
10/07/25,"Circolari, linee guida, Leggi, decreti legislativi e decreti-legge",Italia,Quadri sinottici delle Misure del PNRR del Ministero delle infrastrutture e dei trasporti,null,2025-07-10,https://italiadomani.gov.it,
10/07/25,Italia,,Quadri sinottici delle Misure del PNRR del Ministero delle infrastrutture e dei trasporti,null,2025-07-10,https://italiadomani.gov.it,
10/07/25,"Circolari, linee guida, Leggi, decreti legislativi e decreti-legge",Italia,Quadri sinottici delle Misure del PNRR del Ministero delle infrastrutture e dei trasporti,null,2025-07-10,https://italiadomani.gov.it,
10/07/25,Italia,,Quadri sinottici delle Misure del PNRR del Ministero dell’interno,null,2025-07-10,https://italiadomani.gov.it,
10/07/25,Italia,,Quadri sinottici delle Misure del PNRR del Ministero dell’interno,null,2025-07-10,https://italiadomani.gov.it,
10/07/25,Italia,,Quadri sinottici delle Misure del PNRR della Presidenza del Consiglio dei Ministri - Dipartimento affari regionali e autonomie,null,2025-07-10,https://italiadomani.gov.it,
10/07/25,Italia,,Quadri sinottici delle Misure del PNRR della Presidenza del Consiglio dei Ministri - Dipartimento affari regionali e autonomie,null,2025-07-10,https://italiadomani.gov.it,
10/07/25,Italia,,Quadri sinottici delle Misure del PNRR della Presidenza del Consiglio dei Ministri - Dipartimento della protezione civile,null,2025-07-10,https://italiadomani.gov.it,
10/07/25,Italia,,Quadri sinottici delle Misure del PNRR della Presidenza del Consiglio dei Ministri - Dipartimento della protezione civile,null,2025-07-10,https://italiadomani.gov.it,
10/07/25,Italia,,Quadri sinottici delle Misure del PNRR della Presidenza del Consiglio dei Ministri - Dipartimento per lo sport,null,2025-07-10,https://italiadomani.gov.it,
10/07/25,Italia,,Quadri sinottici delle Misure del PNRR della Presidenza del Consiglio dei Ministri - Dipartimento per lo sport,null,2025-07-10,https://italiadomani.gov.it,
10/07/25,"Circolari, linee guida, Leggi, decreti legislativi e decreti-legge",Italia,Quadro Sinottico delle varianti,null,2025-07-10,https://italiadomani.gov.it,
10/07/25,"Circolari, linee guida, Leggi, decreti legislativi e decreti-legge",Italia,Quadro Sinottico delle varianti,null,2025-07-10,https://italiadomani.gov.it,
10/07/25,Italia,,Quadro Sinottico delle varianti,null,2025-07-10,https://italiadomani.gov.it,
10/07/25,"Circolari, linee guida, Leggi, decreti legislativi e decreti-legge",Italia,Quadro sinottico dei trasferimenti,null,2025-07-10,https://italiadomani.gov.it,
10/07/25,"Circolari, linee guida, Leggi, decreti legislativi e decreti-legge",Italia,Quadro sinottico dei trasferimenti,null,2025-07-10,https://italiadomani.gov.it,
10/07/25,Italia,,Quadro sinottico dei trasferimenti,null,2025-07-10,https://italiadomani.gov.it,
02/04/25,"Leggi, decreti legislativi e decreti-legge",Italia,Sesta Relazione al Parlamento sullo stato di attuazione del Piano Nazionale di Ripresa e Resilienza,null,2025-04-02,https://italiadomani.gov.it,
02/04/25,"Leggi, decreti legislativi e decreti-legge",Italia,Sesta Relazione al Parlamento sullo stato di attuazione del Piano Nazionale di Ripresa e Resilienza,null,2025-04-02,https://italiadomani.gov.it,
02/04/25,"Circolari, linee guida, Leggi, decreti legislativi e decreti-legge",Italia,Sesta Relazione al Parlamento sullo stato di attuazione del Piano Nazionale di Ripresa e Resilienza,null,2025-04-02,https://italiadomani.gov.it,
28/01/25,Altro,,Circolare n. 29 del 31/05/2024,null,2025-01-28,https://italiadomani.gov.it,
28/01/25,Altro,,Circolare n. 29 del 31/05/2024,null,2025-01-28,https://italiadomani.gov.it,
28/01/25,"Leggi, decreti legislativi e decreti-legge",Italia,Circolare n. 29 del 31/05/2024,null,2025-01-28,https://italiadomani.gov.it,
28/01/25,"Circolari, linee guida, Leggi, decreti legislativi e decreti-legge",Italia,Circolare n. 29 del 31/05/2024,null,2025-01-28,https://italiadomani.gov.it,
28/01/25,"Circolari, linee guida",Italia,Circolare n. 33 DEL 15/07/2024 - Aggiornamento Linee guida metodologiche per la rendicontazione degli indicatori comuni per il PNRR,null,2025-01-28,https://italiadomani.gov.it,
28/01/25,"Circolari, linee guida",Italia,Circolare n. 33 DEL 15/07/2024 - Aggiornamento Linee guida metodologiche per la rendicontazione degli indicatori comuni per il PNRR,null,2025-01-28,https://italiadomani.gov.it,
28/01/25,Altro,,Circolare n. 33 DEL 15/07/2024 - Aggiornamento Linee guida metodologiche per la rendicontazione degli indicatori comuni per il PNRR,null,2025-01-28,https://italiadomani.gov.it,
28/01/25,"Leggi, decreti legislativi e decreti-legge",Italia,Circolare n. 33 DEL 15/07/2024 - Aggiornamento Linee guida metodologiche per la rendicontazione degli indicatori comuni per il PNRR,null,2025-01-28,https://italiadomani.gov.it,
28/01/25,"Circolari, linee guida, Leggi, decreti legislativi e decreti-legge",Italia,Circolare n. 33 DEL 15/07/2024 - Aggiornamento Linee guida metodologiche per la rendicontazione degli indicatori comuni per il PNRR,null,2025-01-28,https://italiadomani.gov.it,
28/01/25,"Circolari, linee guida",,Circolare n. 38 del 22/11/2024,null,2025-01-28,https://italiadomani.gov.it,
28/01/25,"Circolari, linee guida",,Circolare n. 38 del 22/11/2024,null,2025-01-28,https://italiadomani.gov.it,
28/01/25,"Circolari, linee guida",Italia,Circolare n. 38 del 22/11/2024,null,2025-01-28,https://italiadomani.gov.it,
28/01/25,Altro,,Circolare n. 38 del 22/11/2024,null,2025-01-28,https://italiadomani.gov.it,
28/01/25,"Leggi, decreti legislativi e decreti-legge",Italia,Circolare n. 38 del 22/11/2024,null,2025-01-28,https://italiadomani.gov.it,
28/01/25,"Circolari, linee guida, Leggi, decreti legislativi e decreti-legge",Italia,Circolare n. 38 del 22/11/2024,null,2025-01-28,https://italiadomani.gov.it,
11/01/25,,,Decreto 6 dicembre 2024 - Criteri e modalità per l'attivazione dei trasferimenti di risorse PNRR,null,2025-01-11,https://italiadomani.gov.it,
11/01/25,,,Decreto 6 dicembre 2024 - Criteri e modalità per l'attivazione dei trasferimenti di risorse PNRR,null,2025-01-11,https://italiadomani.gov.it,
11/01/25,"Circolari, linee guida",,Decreto 6 dicembre 2024 - Criteri e modalità per l'attivazione dei trasferimenti di risorse PNRR,null,2025-01-11,https://italiadomani.gov.it,
11/01/25,"Circolari, linee guida",Italia,Decreto 6 dicembre 2024 - Criteri e modalità per l'attivazione dei trasferimenti di risorse PNRR,null,2025-01-11,https://italiadomani.gov.it,
11/01/25,Altro,,Decreto 6 dicembre 2024 - Criteri e modalità per l'attivazione dei trasferimenti di risorse PNRR,null,2025-01-11,https://italiadomani.gov.it,
11/01/25,"Leggi, decreti legislativi e decreti-legge",Italia,Decreto 6 dicembre 2024 - Criteri e modalità per l'attivazione dei trasferimenti di risorse PNRR,null,2025-01-11,https://italiadomani.gov.it,
30/10/24,,,Raccolta FAQ sul principio DNSH,null,2024-10-30,https://italiadomani.gov.it,
30/10/24,,,Raccolta FAQ sul principio DNSH,null,2024-10-30,https://italiadomani.gov.it,
30/10/24,"Circolari, linee guida",,Raccolta FAQ sul principio DNSH,null,2024-10-30,https://italiadomani.gov.it,
30/10/24,"Circolari, linee guida",Italia,Raccolta FAQ sul principio DNSH,null,2024-10-30,https://italiadomani.gov.it,
30/10/24,Altro,,Raccolta FAQ sul principio DNSH,null,2024-10-30,https://italiadomani.gov.it,
30/07/24,,,Quinta Relazione al Parlamento sullo stato di attuazione del Piano Nazionale di Ripresa e Resilienza,null,2024-07-30,https://italiadomani.gov.it,
30/07/24,,,Quinta Relazione al Parlamento sullo stato di attuazione del Piano Nazionale di Ripresa e Resilienza,null,2024-07-30,https://italiadomani.gov.it,
30/07/24,"Circolari, linee guida",,Quinta Relazione al Parlamento sullo stato di attuazione del Piano Nazionale di Ripresa e Resilienza,null,2024-07-30,https://italiadomani.gov.it,
30/07/24,"Circolari, linee guida",Italia,Quinta Relazione al Parlamento sullo stato di attuazione del Piano Nazionale di Ripresa e Resilienza,null,2024-07-30,https://italiadomani.gov.it,
03/07/24,"Circolari, linee guida",,La Raccolta normativa PNRR,null,2024-07-03,https://italiadomani.gov.it,
03/07/24,"Circolari, linee guida",Italia,La Raccolta normativa PNRR,null,2024-07-03,https://italiadomani.gov.it,
03/07/24,"Circolari, linee guida",,Raccolta normativa PNRR,null,2024-07-03,https://italiadomani.gov.it,
14/05/24,,,Aggiornamento della Guida DNSH emanato a maggio 2024,null,2024-05-14,https://italiadomani.gov.it,
14/05/24,,,Aggiornamento della Guida DNSH emanato a maggio 2024,null,2024-05-14,https://italiadomani.gov.it,
14/05/24,"Circolari, linee guida",Italia,Aggiornamento della Guida DNSH emanato a maggio 2024,null,2024-05-14,https://italiadomani.gov.it,
14/05/24,"Circolari, linee guida",,Aggiornamento della Guida DNSH emanato a maggio 2024,null,2024-05-14,https://italiadomani.gov.it,
22/02/24,,,Quarta relazione al Parlamento sullo stato di attuazione del Piano Nazionale di Ripresa e Resilienza,null,2024-02-22,https://italiadomani.gov.it,
22/02/24,,,Quarta relazione al Parlamento sullo stato di attuazione del Piano Nazionale di Ripresa e Resilienza,null,2024-02-22,https://italiadomani.gov.it,
22/02/24,"Circolari, linee guida",,Quarta relazione al Parlamento sullo stato di attuazione del Piano Nazionale di Ripresa e Resilienza,null,2024-02-22,https://italiadomani.gov.it,
22/02/24,"Circolari, linee guida",Italia,Quarta relazione al Parlamento sullo stato di attuazione del Piano Nazionale di Ripresa e Resilienza,null,2024-02-22,https://italiadomani.gov.it,
07/12/23,,,Manuali operativi per i Soggetti attuatori - Missione 5,null,2023-12-07,https://italiadomani.gov.it,
07/12/23,,,Manuali operativi per i Soggetti attuatori - Missione 5,null,2023-12-07,https://italiadomani.gov.it,
07/12/23,"Circolari, linee guida",,Manuali operativi per i Soggetti attuatori - Missione 5,null,2023-12-07,https://italiadomani.gov.it,
07/12/23,"Circolari, linee guida",Italia,Manuali operativi per i Soggetti attuatori - Missione 5,null,2023-12-07,https://italiadomani.gov.it,
15/09/23,,,"Circolare del 15 settembre 2023, n. 27 - ""Integrazione delle Linee Guida per lo svolgimento delle attività di controllo e rendicontazione delle Misure PNRR di competenza delle Amministrazioni centrali e dei Soggetti Attuatori. Adozione dell’Appendice tematica Rilevazione delle titolarità effettive ex art. 22 par. 2 lett. d) Reg. (UE) 2021/241 e comunicazione alla UIF di operazioni sospette da parte della Pubblica amministrazione ex art. 10, d.lgs. 231/2007.",null,2023-09-15,https://italiadomani.gov.it,
15/09/23,"Circolari, linee guida",Italia,"Circolare del 15 settembre 2023, n. 27 - ""Integrazione delle Linee Guida per lo svolgimento delle attività di controllo e rendicontazione delle Misure PNRR di competenza delle Amministrazioni centrali e dei Soggetti Attuatori. Adozione dell’Appendice tematica Rilevazione delle titolarità effettive ex art. 22 par. 2 lett. d) Reg. (UE) 2021/241 e comunicazione alla UIF di operazioni sospette da parte della Pubblica amministrazione ex art. 10, d.lgs. 231/2007.",null,2023-09-15,https://italiadomani.gov.it,
15/09/23,"Circolari, linee guida",,"Circolare del 15 settembre 2023, n. 27 - ""Integrazione delle Linee Guida per lo svolgimento delle attività di controllo e rendicontazione delle Misure PNRR di competenza delle Amministrazioni centrali e dei Soggetti Attuatori. Adozione dell’Appendice tematica Rilevazione delle titolarità effettive ex art. 22 par. 2 lett. d) Reg. (UE) 2021/241 e comunicazione alla UIF di operazioni sospette da parte della Pubblica amministrazione ex art. 10, d.lgs. 231/2007.",null,2023-09-15,https://italiadomani.gov.it,
01/08/23,"Circolari, linee guida",Italia,Preliminary assessment,null,2023-08-01,https://italiadomani.gov.it,
01/08/23,,,Valutazioni positive (Preliminary assessment) della Commissione europea sulle richieste di pagamento del PNRR italiano (ENG Version),null,2023-08-01,https://italiadomani.gov.it,
01/08/23,"Circolari, linee guida",Italia,Valutazioni positive (Preliminary assessment) della Commissione europea sulle richieste di pagamento del PNRR italiano (ENG Version),null,2023-08-01,https://italiadomani.gov.it,
01/08/23,"Circolari, linee guida",,Valutazioni positive (Preliminary assessment) della Commissione europea sulle richieste di pagamento del PNRR italiano (ENG Version),null,2023-08-01,https://italiadomani.gov.it,
25/07/23,,,Circolare n. 25 del 24.07.2023 “Linee guida operative relative alle modalità di attivazione delle anticipazioni di cassa a valere sulle contabilità di tesoreria NGEU”,null,2023-07-25,https://italiadomani.gov.it,
25/07/23,"Leggi, decreti legislativi e decreti-legge",Italia,Circolare n. 25 del 24.07.2023 “Linee guida operative relative alle modalità di attivazione delle anticipazioni di cassa a valere sulle contabilità di tesoreria NGEU”,null,2023-07-25,https://italiadomani.gov.it,
25/07/23,"Circolari, linee guida",Italia,Circolare n. 25 del 24.07.2023 “Linee guida operative relative alle modalità di attivazione delle anticipazioni di cassa a valere sulle contabilità di tesoreria NGEU”,null,2023-07-25,https://italiadomani.gov.it,
25/07/23,"Circolari, linee guida",,Circolare n. 25 del 24.07.2023 “Linee guida operative relative alle modalità di attivazione delle anticipazioni di cassa a valere sulle contabilità di tesoreria NGEU”,null,2023-07-25,https://italiadomani.gov.it,
22/06/23,,,Manuali tecnico-operativi delle Amministrazioni Centrali,null,2023-06-22,https://italiadomani.gov.it,
22/06/23,"Circolari, linee guida",Italia,Manuali tecnico-operativi delle Amministrazioni Centrali,null,2023-06-22,https://italiadomani.gov.it,
22/06/23,"Leggi, decreti legislativi e decreti-legge",Italia,Manuali tecnico-operativi delle Amministrazioni Centrali,null,2023-06-22,https://italiadomani.gov.it,
22/06/23,"Circolari, linee guida",,Manuali tecnico-operativi delle Amministrazioni Centrali,null,2023-06-22,https://italiadomani.gov.it,
20/06/23,"Circolari, linee guida",,Terza Relazione al Parlamento sullo stato di attuazione del Piano Nazionale di Ripresa e Resilienza,null,2023-06-20,https://italiadomani.gov.it,
20/06/23,"Circolari, linee guida",Italia,Terza Relazione al Parlamento sullo stato di attuazione del Piano Nazionale di Ripresa e Resilienza,null,2023-06-20,https://italiadomani.gov.it,
20/06/23,"Leggi, decreti legislativi e decreti-legge",Italia,Terza Relazione al Parlamento sullo stato di attuazione del Piano Nazionale di Ripresa e Resilienza,null,2023-06-20,https://italiadomani.gov.it,
28/04/23,Decreti amministrativi e regolamenti,Italia,Circolare n. 19 del 27.04.2023 “Utilizzo del sistema ReGiS per gli adempimenti PNRR e modalità di attivazione delle anticipazioni di cassa a valere sulle contabilità di tesoreria NGEU”,null,2023-04-28,https://italiadomani.gov.it,
28/04/23,"Circolari, linee guida",,Circolare n. 19 del 27.04.2023 “Utilizzo del sistema ReGiS per gli adempimenti PNRR e modalità di attivazione delle anticipazioni di cassa a valere sulle contabilità di tesoreria NGEU”,null,2023-04-28,https://italiadomani.gov.it,
28/04/23,"Circolari, linee guida",Italia,Circolare n. 19 del 27.04.2023 “Utilizzo del sistema ReGiS per gli adempimenti PNRR e modalità di attivazione delle anticipazioni di cassa a valere sulle contabilità di tesoreria NGEU”,null,2023-04-28,https://italiadomani.gov.it,
28/04/23,"Leggi, decreti legislativi e decreti-legge",Italia,Circolare n. 19 del 27.04.2023 “Utilizzo del sistema ReGiS per gli adempimenti PNRR e modalità di attivazione delle anticipazioni di cassa a valere sulle contabilità di tesoreria NGEU”,null,2023-04-28,https://italiadomani.gov.it,
20/03/23,"Circolari, linee guida",Italia,"Circolare del 13 marzo 2023, n. 10",null,2023-03-20,https://italiadomani.gov.it,
20/03/23,Decreti amministrativi e regolamenti,Italia,"Circolare del 13 marzo 2023, n. 10",null,2023-03-20,https://italiadomani.gov.it,
20/03/23,"Circolari, linee guida",,"Circolare del 13 marzo 2023, n. 10",null,2023-03-20,https://italiadomani.gov.it,
20/03/23,"Leggi, decreti legislativi e decreti-legge",Italia,"Circolare del 13 marzo 2023, n. 10",null,2023-03-20,https://italiadomani.gov.it,
24/02/23,Normativa e documenti europei,,"DECRETO-LEGGE 24 febbraio 2023, n. 13",null,2023-02-24,https://italiadomani.gov.it,
24/02/23,"Circolari, linee guida",Italia,"DECRETO-LEGGE 24 febbraio 2023, n. 13",null,2023-02-24,https://italiadomani.gov.it,
24/02/23,Decreti amministrativi e regolamenti,Italia,"DECRETO-LEGGE 24 febbraio 2023, n. 13",null,2023-02-24,https://italiadomani.gov.it,
24/02/23,"Circolari, linee guida",,"DECRETO-LEGGE 24 febbraio 2023, n. 13",null,2023-02-24,https://italiadomani.gov.it,
24/02/23,"Leggi, decreti legislativi e decreti-legge",Italia,"DECRETO-LEGGE 24 febbraio 2023, n. 13",null,2023-02-24,https://italiadomani.gov.it,
15/12/22,"Circolari, linee guida, Leggi, decreti legislativi e decreti-legge",Italia,Circolare n.43 del 14.12.2022 “Interventi PNRR gestiti sul modulo finanziario del sistema ReGiS. Operazioni contabili esercizio finanziario 2022”,null,2022-12-15,https://italiadomani.gov.it,
15/12/22,Normativa e documenti europei,,Circolare n.43 del 14.12.2022 “Interventi PNRR gestiti sul modulo finanziario del sistema ReGiS. Operazioni contabili esercizio finanziario 2022”,null,2022-12-15,https://italiadomani.gov.it,
15/12/22,"Circolari, linee guida",Italia,Circolare n.43 del 14.12.2022 “Interventi PNRR gestiti sul modulo finanziario del sistema ReGiS. Operazioni contabili esercizio finanziario 2022”,null,2022-12-15,https://italiadomani.gov.it,
15/12/22,Decreti amministrativi e regolamenti,Italia,Circolare n.43 del 14.12.2022 “Interventi PNRR gestiti sul modulo finanziario del sistema ReGiS. Operazioni contabili esercizio finanziario 2022”,null,2022-12-15,https://italiadomani.gov.it,
15/12/22,"Circolari, linee guida",,Circolare n.43 del 14.12.2022 “Interventi PNRR gestiti sul modulo finanziario del sistema ReGiS. Operazioni contabili esercizio finanziario 2022”,null,2022-12-15,https://italiadomani.gov.it,
13/12/22,,,Circolare n.41 del 7.12.2022 “Piano Nazionale di Ripresa e Resilienza (PNRR) - Rendicontazione milestone/target connessi alla terza “Richiesta di pagamento” alla C.E.”,null,2022-12-13,https://italiadomani.gov.it,
13/12/22,"Circolari, linee guida, Leggi, decreti legislativi e decreti-legge",Italia,Circolare n.41 del 7.12.2022 “Piano Nazionale di Ripresa e Resilienza (PNRR) - Rendicontazione milestone/target connessi alla terza “Richiesta di pagamento” alla C.E.”,null,2022-12-13,https://italiadomani.gov.it,
13/12/22,Normativa e documenti europei,,Circolare n.41 del 7.12.2022 “Piano Nazionale di Ripresa e Resilienza (PNRR) - Rendicontazione milestone/target connessi alla terza “Richiesta di pagamento” alla C.E.”,null,2022-12-13,https://italiadomani.gov.it,
13/12/22,"Circolari, linee guida",Italia,Circolare n.41 del 7.12.2022 “Piano Nazionale di Ripresa e Resilienza (PNRR) - Rendicontazione milestone/target connessi alla terza “Richiesta di pagamento” alla C.E.”,null,2022-12-13,https://italiadomani.gov.it,
13/12/22,Decreti amministrativi e regolamenti,Italia,Circolare n.41 del 7.12.2022 “Piano Nazionale di Ripresa e Resilienza (PNRR) - Rendicontazione milestone/target connessi alla terza “Richiesta di pagamento” alla C.E.”,null,2022-12-13,https://italiadomani.gov.it,
13/12/22,"Circolari, linee guida",,Circolare n.41 del 7.12.2022 “Piano Nazionale di Ripresa e Resilienza (PNRR) - Rendicontazione milestone/target connessi alla terza “Richiesta di pagamento” alla C.E.”,null,2022-12-13,https://italiadomani.gov.it,
24/11/22,,,Decreto del Ragioniere generale dello Stato n.160 del 18 novembre 2022 – Assegnazione risorse del Fondo per l’avvio delle opere indifferibili,null,2022-11-24,https://italiadomani.gov.it,
24/11/22,"Circolari, linee guida",Italia,Decreto del Ragioniere generale dello Stato n.160 del 18 novembre 2022 – Assegnazione risorse del Fondo per l’avvio delle opere indifferibili,null,2022-11-24,https://italiadomani.gov.it,
24/11/22,"Circolari, linee guida, Leggi, decreti legislativi e decreti-legge",Italia,Decreto del Ragioniere generale dello Stato n.160 del 18 novembre 2022 – Assegnazione risorse del Fondo per l’avvio delle opere indifferibili,null,2022-11-24,https://italiadomani.gov.it,
24/11/22,Normativa e documenti europei,,Decreto del Ragioniere generale dello Stato n.160 del 18 novembre 2022 – Assegnazione risorse del Fondo per l’avvio delle opere indifferibili,null,2022-11-24,https://italiadomani.gov.it,
24/11/22,Decreti amministrativi e regolamenti,Italia,Decreto del Ragioniere generale dello Stato n.160 del 18 novembre 2022 – Assegnazione risorse del Fondo per l’avvio delle opere indifferibili,null,2022-11-24,https://italiadomani.gov.it,
24/11/22,Decreti amministrativi e regolamenti,Italia,Decreto del Ragioniere generale dello Stato n.160 del 18 novembre 2022 – Assegnazione risorse del Fondo per l’avvio delle opere indifferibili,,2022-11-24,https://italiadomani.gov.it,
09/11/22,,,Circolare n.37 del 09.11.2022 “Procedura “semplificata” di cui all’articolo 7 del DPCM 28 luglio 2022 e articolo 29 del decreto-legge n. 144 del 2022: rimodulazioni e verifiche in itinere ed ex post.”,null,2022-11-09,https://italiadomani.gov.it,
09/11/22,"Circolari, linee guida",Italia,Circolare n.37 del 09.11.2022 “Procedura “semplificata” di cui all’articolo 7 del DPCM 28 luglio 2022 e articolo 29 del decreto-legge n. 144 del 2022: rimodulazioni e verifiche in itinere ed ex post.”,null,2022-11-09,https://italiadomani.gov.it,
09/11/22,"Circolari, linee guida, Leggi, decreti legislativi e decreti-legge",Italia,Circolare n.37 del 09.11.2022 “Procedura “semplificata” di cui all’articolo 7 del DPCM 28 luglio 2022 e articolo 29 del decreto-legge n. 144 del 2022: rimodulazioni e verifiche in itinere ed ex post.”,null,2022-11-09,https://italiadomani.gov.it,
09/11/22,Normativa e documenti europei,,Circolare n.37 del 09.11.2022 “Procedura “semplificata” di cui all’articolo 7 del DPCM 28 luglio 2022 e articolo 29 del decreto-legge n. 144 del 2022: rimodulazioni e verifiche in itinere ed ex post.”,null,2022-11-09,https://italiadomani.gov.it,
09/11/22,"Circolari, linee guida",Italia,Circolare n.37 del 09.11.2022 “Procedura “semplificata” di cui all’articolo 7 del DPCM 28 luglio 2022 e articolo 29 del decreto-legge n. 144 del 2022: rimodulazioni e verifiche in itinere ed ex post.”,,2022-11-09,https://italiadomani.gov.it,
28/10/22,"Circolari, linee guida",Italia,Aggiornamento della Guida DNSH emanato ad ottobre 2022,null,2022-10-28,https://italiadomani.gov.it,
28/10/22,"Circolari, linee guida, Leggi, decreti legislativi e decreti-legge",Italia,Aggiornamento della Guida DNSH emanato ad ottobre 2022,null,2022-10-28,https://italiadomani.gov.it,
28/10/22,Normativa e documenti europei,,Aggiornamento della Guida DNSH emanato ad ottobre 2022,null,2022-10-28,https://italiadomani.gov.it,
28/10/22,"Circolari, linee guida",Italia,Aggiornamento della Guida DNSH emanato ad ottobre 2022,,2022-10-28,https://italiadomani.gov.it,
28/10/22,,,Operational arrangements tra la Commissione Europea e l’Italia,null,2022-10-28,https://italiadomani.gov.it,
28/10/22,"Circolari, linee guida",Italia,Operational arrangements tra la Commissione Europea e l’Italia,null,2022-10-28,https://italiadomani.gov.it,
28/10/22,"Circolari, linee guida, Leggi, decreti legislativi e decreti-legge",Italia,Operational arrangements tra la Commissione Europea e l’Italia,null,2022-10-28,https://italiadomani.gov.it,
28/10/22,Normativa e documenti europei,,Operational arrangements tra la Commissione Europea e l’Italia,null,2022-10-28,https://italiadomani.gov.it,
28/10/22,Normativa e documenti europei,,Operational arrangements tra la Commissione Europea e l’Italia,,2022-10-28,https://italiadomani.gov.it,
26/10/22,,,Circolare n.34 del 17 ottobre 2022 “Linee guida metodologiche per la rendicontazione degli indicatori comuni per il Piano nazionale di ripresa e resilienza”,null,2022-10-26,https://italiadomani.gov.it,
26/10/22,Decreti amministrativi e regolamenti,,Circolare n.34 del 17 ottobre 2022 “Linee guida metodologiche per la rendicontazione degli indicatori comuni per il Piano nazionale di ripresa e resilienza”,null,2022-10-26,https://italiadomani.gov.it,
26/10/22,"Circolari, linee guida",Italia,Circolare n.34 del 17 ottobre 2022 “Linee guida metodologiche per la rendicontazione degli indicatori comuni per il Piano nazionale di ripresa e resilienza”,null,2022-10-26,https://italiadomani.gov.it,
26/10/22,"Circolari, linee guida, Leggi, decreti legislativi e decreti-legge",Italia,Circolare n.34 del 17 ottobre 2022 “Linee guida metodologiche per la rendicontazione degli indicatori comuni per il Piano nazionale di ripresa e resilienza”,null,2022-10-26,https://italiadomani.gov.it,
26/10/22,"Circolari, linee guida, Leggi, decreti legislativi e decreti-legge",Italia,Circolare n.34 del 17 ottobre 2022 “Linee guida metodologiche per la rendicontazione degli indicatori comuni per il Piano nazionale di ripresa e resilienza”,,2022-10-26,https://italiadomani.gov.it,
05/10/22,"Circolari, linee guida",Italia,Allegato 1 alla Seconda Relazione al Parlamento sullo stato di attuazione del Piano Nazionale di Ripresa e Resilienza nell’esercizio 2022,,2022-10-05,https://italiadomani.gov.it,
05/10/22,"Circolari, linee guida",Italia,Relazione al Parlamento sullo stato di attuazione del Piano Nazionale di Ripresa e Resilienza,,2022-10-05,https://italiadomani.gov.it,
05/10/22,,,Seconda Relazione al Parlamento sullo stato di attuazione del Piano Nazionale di Ripresa e Resilienza,null,2022-10-05,https://italiadomani.gov.it,
05/10/22,Italia,,Seconda Relazione al Parlamento sullo stato di attuazione del Piano Nazionale di Ripresa e Resilienza,null,2022-10-05,https://italiadomani.gov.it,
05/10/22,Decreti amministrativi e regolamenti,,Seconda Relazione al Parlamento sullo stato di attuazione del Piano Nazionale di Ripresa e Resilienza,null,2022-10-05,https://italiadomani.gov.it,
05/10/22,"Circolari, linee guida",Italia,Seconda Relazione al Parlamento sullo stato di attuazione del Piano Nazionale di Ripresa e Resilienza,null,2022-10-05,https://italiadomani.gov.it,
05/10/22,"Circolari, linee guida",Italia,Seconda Relazione al Parlamento sullo stato di attuazione del Piano Nazionale di Ripresa e Resilienza,,2022-10-05,https://italiadomani.gov.it,
23/09/22,,,Circolare n.28 del 4.07.2022 “Controllo di regolarità amministrativa e contabile dei rendiconti di contabilità ordinaria e di contabilità speciale. Controllo di regolarità amministrativa e contabile sugli atti di gestione delle risorse del PNRR - prime indicazioni operative”,null,2022-09-23,https://italiadomani.gov.it,
23/09/22,Italia,,Circolare n.28 del 4.07.2022 “Controllo di regolarità amministrativa e contabile dei rendiconti di contabilità ordinaria e di contabilità speciale. Controllo di regolarità amministrativa e contabile sugli atti di gestione delle risorse del PNRR - prime indicazioni operative”,null,2022-09-23,https://italiadomani.gov.it,
23/09/22,Decreti amministrativi e regolamenti,,Circolare n.28 del 4.07.2022 “Controllo di regolarità amministrativa e contabile dei rendiconti di contabilità ordinaria e di contabilità speciale. Controllo di regolarità amministrativa e contabile sugli atti di gestione delle risorse del PNRR - prime indicazioni operative”,null,2022-09-23,https://italiadomani.gov.it,
23/09/22,"Circolari, linee guida",Italia,Circolare n.28 del 4.07.2022 “Controllo di regolarità amministrativa e contabile dei rendiconti di contabilità ordinaria e di contabilità speciale. Controllo di regolarità amministrativa e contabile sugli atti di gestione delle risorse del PNRR - prime indicazioni operative”,null,2022-09-23,https://italiadomani.gov.it,
23/09/22,"Circolari, linee guida",Italia,Circolare n.28 del 4.07.2022 “Controllo di regolarità amministrativa e contabile dei rendiconti di contabilità ordinaria e di contabilità speciale. Controllo di regolarità amministrativa e contabile sugli atti di gestione delle risorse del PNRR - prime indicazioni operative”,,2022-09-23,https://italiadomani.gov.it,
23/09/22,Italia,,Circolare n.28 del 4.07.2022 “Controllo di regolarità amministrativa e contabile dei rendiconti di contabilità ordinaria e di contabilità speciale. Controllo di regolarità amministrativa e contabile sugli atti di gestione delle risorse del PNRR - prime indicazioni operative”,,2022-09-23,https://italiadomani.gov.it,
23/09/22,,,"Circolare n.31 del 21.09.2022 “Modalità di accesso al Fondo per l’avvio di opere indifferibili di cui all'articolo 26, commi 7 e 7-bis, del decreto-legge 17 maggio 2022, n. 50.",null,2022-09-23,https://italiadomani.gov.it,
23/09/22,"Circolari, linee guida",,"Circolare n.31 del 21.09.2022 “Modalità di accesso al Fondo per l’avvio di opere indifferibili di cui all'articolo 26, commi 7 e 7-bis, del decreto-legge 17 maggio 2022, n. 50.",null,2022-09-23,https://italiadomani.gov.it,
23/09/22,Italia,,"Circolare n.31 del 21.09.2022 “Modalità di accesso al Fondo per l’avvio di opere indifferibili di cui all'articolo 26, commi 7 e 7-bis, del decreto-legge 17 maggio 2022, n. 50.",null,2022-09-23,https://italiadomani.gov.it,
23/09/22,Decreti amministrativi e regolamenti,,"Circolare n.31 del 21.09.2022 “Modalità di accesso al Fondo per l’avvio di opere indifferibili di cui all'articolo 26, commi 7 e 7-bis, del decreto-legge 17 maggio 2022, n. 50.",null,2022-09-23,https://italiadomani.gov.it,
23/09/22,"Circolari, linee guida",Italia,"Circolare n.31 del 21.09.2022 “Modalità di accesso al Fondo per l’avvio di opere indifferibili di cui all'articolo 26, commi 7 e 7-bis, del decreto-legge 17 maggio 2022, n. 50.",null,2022-09-23,https://italiadomani.gov.it,
23/09/22,"Circolari, linee guida",Italia,"Circolare n.31 del 21.09.2022 “Modalità di accesso al Fondo per l’avvio di opere indifferibili di cui all'articolo 26, commi 7 e 7-bis, del decreto-legge 17 maggio 2022, n. 50.",,2022-09-23,https://italiadomani.gov.it,
23/09/22,"Circolari, linee guida",,"Circolare n.31 del 21.09.2022 “Modalità di accesso al Fondo per l’avvio di opere indifferibili di cui all'articolo 26, commi 7 e 7-bis, del decreto-legge 17 maggio 2022, n. 50.",,2022-09-23,https://italiadomani.gov.it,
23/09/22,Italia,,"Circolare n.31 del 21.09.2022 “Modalità di accesso al Fondo per l’avvio di opere indifferibili di cui all'articolo 26, commi 7 e 7-bis, del decreto-legge 17 maggio 2022, n. 50.",,2022-09-23,https://italiadomani.gov.it,
23/09/22,Italia,,Circolare n.32 del 22.09.2022 “Piano Nazionale di Ripresa e Resilienza - acquisto di immobili pubblici a valere sul PNRR”,,2022-09-23,https://italiadomani.gov.it,
23/09/22,Altro,,Circolare n.32 del 22.09.2022 “Piano Nazionale di Ripresa e Resilienza - acquisto di immobili pubblici a valere sul PNRR”,,2022-09-23,https://italiadomani.gov.it,
23/09/22,"Circolari, linee guida",,Circolare n.32 del 22.09.2022 “Piano Nazionale di Ripresa e Resilienza - acquisto di immobili pubblici a valere sul PNRR”,,2022-09-23,https://italiadomani.gov.it,
23/09/22,"Circolari, linee guida",Italia,Circolare n.32 del 22.09.2022 “Piano Nazionale di Ripresa e Resilienza - acquisto di immobili pubblici a valere sul PNRR”,,2022-09-23,https://italiadomani.gov.it,
23/09/22,,,"Circolare n.32 del 22.09.2022 “Piano Nazionale di Ripresa e Resilienza – acquisto di immobili a valere sul PNRR""",null,2022-09-23,https://italiadomani.gov.it,
23/09/22,Altro,,"Circolare n.32 del 22.09.2022 “Piano Nazionale di Ripresa e Resilienza – acquisto di immobili a valere sul PNRR""",null,2022-09-23,https://italiadomani.gov.it,
23/09/22,"Circolari, linee guida",,"Circolare n.32 del 22.09.2022 “Piano Nazionale di Ripresa e Resilienza – acquisto di immobili a valere sul PNRR""",null,2022-09-23,https://italiadomani.gov.it,
23/09/22,Italia,,"Circolare n.32 del 22.09.2022 “Piano Nazionale di Ripresa e Resilienza – acquisto di immobili a valere sul PNRR""",null,2022-09-23,https://italiadomani.gov.it,
23/09/22,Decreti amministrativi e regolamenti,,"Circolare n.32 del 22.09.2022 “Piano Nazionale di Ripresa e Resilienza – acquisto di immobili a valere sul PNRR""",null,2022-09-23,https://italiadomani.gov.it,
23/09/22,Italia,,"Circolare n.32 del 22.09.2022 “Piano Nazionale di Ripresa e Resilienza – acquisto di immobili a valere sul PNRR""",,2022-09-23,https://italiadomani.gov.it,
24/08/22,,,D.M. MEF 06.08.2021 “Assegnazione delle risorse finanziarie previste per l’attuazione degli interventi del Piano nazionale di ripresa e resilienza (PNRR) e s.m.i.”,null,2022-08-24,https://italiadomani.gov.it,
24/08/22,Altro,,D.M. MEF 06.08.2021 “Assegnazione delle risorse finanziarie previste per l’attuazione degli interventi del Piano nazionale di ripresa e resilienza (PNRR) e s.m.i.”,null,2022-08-24,https://italiadomani.gov.it,
24/08/22,"Circolari, linee guida",,D.M. MEF 06.08.2021 “Assegnazione delle risorse finanziarie previste per l’attuazione degli interventi del Piano nazionale di ripresa e resilienza (PNRR) e s.m.i.”,null,2022-08-24,https://italiadomani.gov.it,
24/08/22,Italia,,D.M. MEF 06.08.2021 “Assegnazione delle risorse finanziarie previste per l’attuazione degli interventi del Piano nazionale di ripresa e resilienza (PNRR) e s.m.i.”,null,2022-08-24,https://italiadomani.gov.it,
24/08/22,,,"D.M. MEF 06.08.2021 “Assegnazione delle risorse finanziarie previste per l’attuazione degli interventi del Piano nazionale di ripresa e resilienza (PNRR)"" e s.m.i.",null,2022-08-24,https://italiadomani.gov.it,
12/08/22,,,Circolare n.30 dell’11.08.2022 “Circolare sulle procedure di controllo e rendicontazione delle misure PNRR”,null,2022-08-12,https://italiadomani.gov.it,
12/08/22,Decreti amministrativi e regolamenti,,Circolare n.30 dell’11.08.2022 “Circolare sulle procedure di controllo e rendicontazione delle misure PNRR”,null,2022-08-12,https://italiadomani.gov.it,
12/08/22,Altro,,Circolare n.30 dell’11.08.2022 “Circolare sulle procedure di controllo e rendicontazione delle misure PNRR”,null,2022-08-12,https://italiadomani.gov.it,
12/08/22,"Circolari, linee guida",,Circolare n.30 dell’11.08.2022 “Circolare sulle procedure di controllo e rendicontazione delle misure PNRR”,null,2022-08-12,https://italiadomani.gov.it,
12/08/22,"Circolari, linee guida",,Circolare n.30 dell’11.08.2022 “Circolare sulle procedure di controllo e rendicontazione delle misure PNRR”,,2022-08-12,https://italiadomani.gov.it,
12/08/22,Decreti amministrativi e regolamenti,,Circolare n.30 dell’11.08.2022 “Circolare sulle procedure di controllo e rendicontazione delle misure PNRR”,,2022-08-12,https://italiadomani.gov.it,
12/08/22,Altro,,Circolare n.30 dell’11.08.2022 “Circolare sulle procedure di controllo e rendicontazione delle misure PNRR”,,2022-08-12,https://italiadomani.gov.it,
12/08/22,Italia,,Circolare n.30 dell’11.08.2022 “Circolare sulle procedure di controllo e rendicontazione delle misure PNRR”,,2022-08-12,https://italiadomani.gov.it,
26/07/22,,,Circolare n.29 del 26.07.2022 “Modalità di erogazione delle risorse PNRR e principali modalità di contabilizzazione da parte degli enti territoriali soggetti attuatori”,null,2022-07-26,https://italiadomani.gov.it,
26/07/22,Decreti amministrativi e regolamenti,,Circolare n.29 del 26.07.2022 “Modalità di erogazione delle risorse PNRR e principali modalità di contabilizzazione da parte degli enti territoriali soggetti attuatori”,null,2022-07-26,https://italiadomani.gov.it,
26/07/22,Altro,,Circolare n.29 del 26.07.2022 “Modalità di erogazione delle risorse PNRR e principali modalità di contabilizzazione da parte degli enti territoriali soggetti attuatori”,null,2022-07-26,https://italiadomani.gov.it,
26/07/22,Altro,,Circolare n.29 del 26.07.2022 “Modalità di erogazione delle risorse PNRR e principali modalità di contabilizzazione da parte degli enti territoriali soggetti attuatori”,,2022-07-26,https://italiadomani.gov.it,
26/07/22,Decreti amministrativi e regolamenti,,Circolare n.29 del 26.07.2022 “Modalità di erogazione delle risorse PNRR e principali modalità di contabilizzazione da parte degli enti territoriali soggetti attuatori”,,2022-07-26,https://italiadomani.gov.it,
26/07/22,"Circolari, linee guida",,Circolare n.29 del 26.07.2022 “Modalità di erogazione delle risorse PNRR e principali modalità di contabilizzazione da parte degli enti territoriali soggetti attuatori”,,2022-07-26,https://italiadomani.gov.it,
22/07/22,,,Le domande su ReGiS: risposte per gli attori istituzionali del PNRR,null,2022-07-22,https://italiadomani.gov.it,
22/07/22,Altro,,Le domande su ReGiS: risposte per gli attori istituzionali del PNRR,null,2022-07-22,https://italiadomani.gov.it,
22/07/22,Decreti amministrativi e regolamenti,,Le domande su ReGiS: risposte per gli attori istituzionali del PNRR,null,2022-07-22,https://italiadomani.gov.it,
22/07/22,Decreti amministrativi e regolamenti,,Le domande su ReGiS: risposte per gli attori istituzionali del PNRR,,2022-07-22,https://italiadomani.gov.it,
22/07/22,Altro,,Le domande su ReGiS: risposte per gli attori istituzionali del PNRR,,2022-07-22,https://italiadomani.gov.it,
14/07/22,,,M1C2-16 – Investimento 3 “Connessioni Internet veloci (banda ultra-larga e 5G)” - Avvisi di aggiudicazione appalto per progetti di connessione veloce,null,2022-07-14,https://italiadomani.gov.it,
14/07/22,"Circolari, linee guida",,M1C2-16 – Investimento 3 “Connessioni Internet veloci (banda ultra-larga e 5G)” - Avvisi di aggiudicazione appalto per progetti di connessione veloce,null,2022-07-14,https://italiadomani.gov.it,
14/07/22,"Circolari, linee guida",,M1C2-16 – Investimento 3 “Connessioni Internet veloci (banda ultra-larga e 5G)” - Avvisi di aggiudicazione appalto per progetti di connessione veloce,,2022-07-14,https://italiadomani.gov.it,
14/07/22,Altro,,M1C2-16 – Investimento 3 “Connessioni Internet veloci (banda ultra-larga e 5G)” - Avvisi di aggiudicazione appalto per progetti di connessione veloce,,2022-07-14,https://italiadomani.gov.it,
14/07/22,,,"M4C2-18 - Investimento 1.5: Creazione e rafforzamento di ""ecosistemi dell'innovazione per la sostenibilità"", creazione di ""leader territoriali di R&S"" – Decreti di concessione dei finanziamenti",null,2022-07-14,https://italiadomani.gov.it,
14/07/22,"Circolari, linee guida",,"M4C2-18 - Investimento 1.5: Creazione e rafforzamento di ""ecosistemi dell'innovazione per la sostenibilità"", creazione di ""leader territoriali di R&S"" – Decreti di concessione dei finanziamenti",null,2022-07-14,https://italiadomani.gov.it,
14/07/22,Altro,,"M4C2-18 - Investimento 1.5: Creazione e rafforzamento di ""ecosistemi dell'innovazione per la sostenibilità"", creazione di ""leader territoriali di R&S"" – Decreti di concessione dei finanziamenti",null,2022-07-14,https://italiadomani.gov.it,
14/07/22,Altro,,"M4C2-18 - Investimento 1.5: Creazione e rafforzamento di ""ecosistemi dell'innovazione per la sostenibilità"", creazione di ""leader territoriali di R&S"" – Decreti di concessione dei finanziamenti",,2022-07-14,https://italiadomani.gov.it,
14/07/22,"Circolari, linee guida",,"M4C2-18 - Investimento 1.5: Creazione e rafforzamento di ""ecosistemi dell'innovazione per la sostenibilità"", creazione di ""leader territoriali di R&S"" – Decreti di concessione dei finanziamenti",,2022-07-14,https://italiadomani.gov.it,
14/07/22,Decreti amministrativi e regolamenti,,"M4C2-18 - Investimento 1.5: Creazione e rafforzamento di ""ecosistemi dell'innovazione per la sostenibilità"", creazione di ""leader territoriali di R&S"" – Decreti di concessione dei finanziamenti",,2022-07-14,https://italiadomani.gov.it,
14/07/22,,,"M4C2-19 - Investimento 1.4: Potenziamento strutture di ricerca e creazione di ""campioni nazionali di R&S"" su alcune Key Enabling Technologies – Decreti di concessione dei finanziamenti",null,2022-07-14,https://italiadomani.gov.it,
14/07/22,Altro,,"M4C2-19 - Investimento 1.4: Potenziamento strutture di ricerca e creazione di ""campioni nazionali di R&S"" su alcune Key Enabling Technologies – Decreti di concessione dei finanziamenti",null,2022-07-14,https://italiadomani.gov.it,
14/07/22,Decreti amministrativi e regolamenti,,"M4C2-19 - Investimento 1.4: Potenziamento strutture di ricerca e creazione di ""campioni nazionali di R&S"" su alcune Key Enabling Technologies – Decreti di concessione dei finanziamenti",null,2022-07-14,https://italiadomani.gov.it,
14/07/22,Decreti amministrativi e regolamenti,,"M4C2-19 - Investimento 1.4: Potenziamento strutture di ricerca e creazione di ""campioni nazionali di R&S"" su alcune Key Enabling Technologies – Decreti di concessione dei finanziamenti",,2022-07-14,https://italiadomani.gov.it,
14/07/22,"Circolari, linee guida",,"M4C2-19 - Investimento 1.4: Potenziamento strutture di ricerca e creazione di ""campioni nazionali di R&S"" su alcune Key Enabling Technologies – Decreti di concessione dei finanziamenti",,2022-07-14,https://italiadomani.gov.it,
14/07/22,Altro,,"M4C2-19 - Investimento 1.4: Potenziamento strutture di ricerca e creazione di ""campioni nazionali di R&S"" su alcune Key Enabling Technologies – Decreti di concessione dei finanziamenti",,2022-07-14,https://italiadomani.gov.it,
22/06/22,,,Circolare n. 26 del 14.06.2022 “Rendicontazione Milestone/Target connessi alla seconda Richiesta di pagamento alla C.E. prevista per il 28 giugno 2022”,null,2022-06-22,https://italiadomani.gov.it,
22/06/22,"Circolari, linee guida",,Circolare n. 26 del 14.06.2022 “Rendicontazione Milestone/Target connessi alla seconda Richiesta di pagamento alla C.E. prevista per il 28 giugno 2022”,null,2022-06-22,https://italiadomani.gov.it,
22/06/22,"Circolari, linee guida",,Circolare n. 26 del 14.06.2022 “Rendicontazione Milestone/Target connessi alla seconda Richiesta di pagamento alla C.E. prevista per il 28 giugno 2022”,,2022-06-22,https://italiadomani.gov.it,
22/06/22,"Leggi, decreti legislativi e decreti-legge",,Circolare n. 26 del 14.06.2022 “Rendicontazione Milestone/Target connessi alla seconda Richiesta di pagamento alla C.E. prevista per il 28 giugno 2022”,,2022-06-22,https://italiadomani.gov.it,
22/06/22,,,Circolare n.21 del 29.04.2022 “Chiarimenti in relazione alla disciplina nazionale in materia di contratti pubblici richiamata nei dispositivi attuativi relativi agli interventi PNRR e PNC”,null,2022-06-22,https://italiadomani.gov.it,
22/06/22,"Circolari, linee guida",,Circolare n.21 del 29.04.2022 “Chiarimenti in relazione alla disciplina nazionale in materia di contratti pubblici richiamata nei dispositivi attuativi relativi agli interventi PNRR e PNC”,null,2022-06-22,https://italiadomani.gov.it,
22/06/22,"Circolari, linee guida",,Circolare n.21 del 29.04.2022 “Chiarimenti in relazione alla disciplina nazionale in materia di contratti pubblici richiamata nei dispositivi attuativi relativi agli interventi PNRR e PNC”,,2022-06-22,https://italiadomani.gov.it,
22/06/22,"Leggi, decreti legislativi e decreti-legge",,Circolare n.21 del 29.04.2022 “Chiarimenti in relazione alla disciplina nazionale in materia di contratti pubblici richiamata nei dispositivi attuativi relativi agli interventi PNRR e PNC”,,2022-06-22,https://italiadomani.gov.it,
22/06/22,,,Circolare n.27 del 21.06.2022 “Monitoraggio delle misure PNRR”,null,2022-06-22,https://italiadomani.gov.it,
22/06/22,"Circolari, linee guida",,Circolare n.27 del 21.06.2022 “Monitoraggio delle misure PNRR”,null,2022-06-22,https://italiadomani.gov.it,
22/06/22,"Circolari, linee guida",,Circolare n.27 del 21.06.2022 “Monitoraggio delle misure PNRR”,,2022-06-22,https://italiadomani.gov.it,
22/06/22,"Leggi, decreti legislativi e decreti-legge",,Circolare n.27 del 21.06.2022 “Monitoraggio delle misure PNRR”,,2022-06-22,https://italiadomani.gov.it,
22/06/22,,,Circolare n.31 del 14.12.2021 “Rendicontazione PNRR al 31.12.2021 - Trasmissione dichiarazione di gestione e check-list relativa a milestone e target,null,2022-06-22,https://italiadomani.gov.it,
22/06/22,"Circolari, linee guida",,Circolare n.31 del 14.12.2021 “Rendicontazione PNRR al 31.12.2021 - Trasmissione dichiarazione di gestione e check-list relativa a milestone e target,null,2022-06-22,https://italiadomani.gov.it,
22/06/22,"Circolari, linee guida",,Circolare n.31 del 14.12.2021 “Rendicontazione PNRR al 31.12.2021 - Trasmissione dichiarazione di gestione e check-list relativa a milestone e target,,2022-06-22,https://italiadomani.gov.it,
21/06/22,"Circolari, linee guida",,Circolare n.27 del 21.06.2022 “Monitoraggio delle misure PNRR”,,2022-06-21,https://italiadomani.gov.it,
14/06/22,"Circolari, linee guida",,Circolare n. 26 del 14.06.2022 “Rendicontazione Milestone/Target connessi alla seconda Richiesta di pagamento alla C.E. prevista per il 28 giugno 2022”,,2022-06-14,https://italiadomani.gov.it,
13/06/22,,,Circolare n.6 del 13/06/2022 recante Contrasto alle infiltrazioni mafiose nell’ambito della realizzazione delle progettualità inerenti al Piano Nazionale di Ripresa e di Resilienza (PNRR).,null,2022-06-13,https://italiadomani.gov.it,
13/06/22,"Leggi, decreti legislativi e decreti-legge",,Circolare n.6 del 13/06/2022 recante Contrasto alle infiltrazioni mafiose nell’ambito della realizzazione delle progettualità inerenti al Piano Nazionale di Ripresa e di Resilienza (PNRR).,null,2022-06-13,https://italiadomani.gov.it,
13/06/22,"Leggi, decreti legislativi e decreti-legge",,Circolare n.6 del 13/06/2022 recante Contrasto alle infiltrazioni mafiose nell’ambito della realizzazione delle progettualità inerenti al Piano Nazionale di Ripresa e di Resilienza (PNRR).,,2022-06-13,https://italiadomani.gov.it,
13/06/22,Normativa e documenti europei,,Circolare n.6 del 13/06/2022 recante Contrasto alle infiltrazioni mafiose nell’ambito della realizzazione delle progettualità inerenti al Piano Nazionale di Ripresa e di Resilienza (PNRR).,,2022-06-13,https://italiadomani.gov.it,
13/06/22,"Circolari, linee guida",,Circolare n.6 del 13/06/2022 recante Contrasto alle infiltrazioni mafiose nell’ambito della realizzazione delle progettualità inerenti al Piano Nazionale di Ripresa e di Resilienza (PNRR).,,2022-06-13,https://italiadomani.gov.it,
10/05/22,,,DL 152/2021 recante disposizioni urgenti per l'attuazione del Piano nazionale di ripresa e resilienza (PNRR) e per la prevenzione delle infiltrazioni mafiose,null,2022-05-10,https://italiadomani.gov.it,
10/05/22,Normativa e documenti europei,,DL 152/2021 recante disposizioni urgenti per l'attuazione del Piano nazionale di ripresa e resilienza (PNRR) e per la prevenzione delle infiltrazioni mafiose,null,2022-05-10,https://italiadomani.gov.it,
10/05/22,Normativa e documenti europei,,DL 152/2021 recante disposizioni urgenti per l'attuazione del Piano nazionale di ripresa e resilienza (PNRR) e per la prevenzione delle infiltrazioni mafiose,,2022-05-10,https://italiadomani.gov.it,
10/05/22,Presentazioni,,DL 152/2021 recante disposizioni urgenti per l'attuazione del Piano nazionale di ripresa e resilienza (PNRR) e per la prevenzione delle infiltrazioni mafiose,,2022-05-10,https://italiadomani.gov.it,
10/05/22,"Leggi, decreti legislativi e decreti-legge",,DL 152/2021 recante disposizioni urgenti per l'attuazione del Piano nazionale di ripresa e resilienza (PNRR) e per la prevenzione delle infiltrazioni mafiose,,2022-05-10,https://italiadomani.gov.it,
10/05/22,,,DL 36/2022 recante ulteriori misure urgenti per l'attuazione del Piano nazionale di ripresa e resilienza (PNRR).,null,2022-05-10,https://italiadomani.gov.it,
10/05/22,"Leggi, decreti legislativi e decreti-legge",,DL 36/2022 recante ulteriori misure urgenti per l'attuazione del Piano nazionale di ripresa e resilienza (PNRR).,null,2022-05-10,https://italiadomani.gov.it,
10/05/22,"Leggi, decreti legislativi e decreti-legge",,DL 36/2022 recante ulteriori misure urgenti per l'attuazione del Piano nazionale di ripresa e resilienza (PNRR).,,2022-05-10,https://italiadomani.gov.it,
10/05/22,Presentazioni,,DL 36/2022 recante ulteriori misure urgenti per l'attuazione del Piano nazionale di ripresa e resilienza (PNRR).,,2022-05-10,https://italiadomani.gov.it,
10/05/22,Normativa e documenti europei,,DL 36/2022 recante ulteriori misure urgenti per l'attuazione del Piano nazionale di ripresa e resilienza (PNRR).,,2022-05-10,https://italiadomani.gov.it,
29/04/22,"Circolari, linee guida",,Circolare n.21 del 29.04.2022 “Chiarimenti in relazione alla disciplina nazionale in materia di contratti pubblici richiamata nei dispositivi attuativi relativi agli interventi PNRR e PNC”,,2022-04-29,https://italiadomani.gov.it,
13/04/22,,,Decisione di esecuzione della Commissione Ue sulla prima rata dei fondi PNRR,null,2022-04-13,https://italiadomani.gov.it,
13/04/22,Presentazioni,,Decisione di esecuzione della Commissione Ue sulla prima rata dei fondi PNRR,null,2022-04-13,https://italiadomani.gov.it,
13/04/22,Presentazioni,,Decisione di esecuzione della Commissione Ue sulla prima rata dei fondi PNRR,,2022-04-13,https://italiadomani.gov.it,
13/04/22,Normativa e documenti europei,,Decisione di esecuzione della Commissione Ue sulla prima rata dei fondi PNRR,,2022-04-13,https://italiadomani.gov.it,
13/04/22,Normativa e documenti europei,,Decisione di esecuzione della Commissione Ue sulla prima rata dei fondi PNRR,/content/dam/sogei-ng/documenti/COMMISSION_IMPLEMENTING_DECISION_IT.pdf,2022-04-13,https://italiadomani.gov.it/content/dam/sogei-ng/documenti/COMMISSION_IMPLEMENTING_DECISION_IT.pdf,
31/03/22,,,Le slide del Webinar “Il principio DNSH nella produzione di energia”,null,2022-03-31,https://italiadomani.gov.it,
31/03/22,Presentazioni,,Le slide del Webinar “Il principio DNSH nella produzione di energia”,null,2022-03-31,https://italiadomani.gov.it,
31/03/22,Presentazioni,,Le slide del Webinar “Il principio DNSH nella produzione di energia”,,2022-03-31,https://italiadomani.gov.it,
31/03/22,Altro,Italia,Le slide del Webinar “Il principio DNSH nella produzione di energia”,,2022-03-31,https://italiadomani.gov.it,
31/03/22,Presentazioni,,Le slide del Webinar “Il principio DNSH nella produzione di energia”,/content/dam/sogei-ng/documenti/DNSH_Modulo%204_Produzione%20energia.pptx,2022-03-31,https://italiadomani.gov.it/content/dam/sogei-ng/documenti/DNSH_Modulo%204_Produzione%20energia.pptx,
09/03/22,,,Le slide del Webinar “Il principio DNSH nelle infrastrutture e nei trasporti”,null,2022-03-09,https://italiadomani.gov.it,
09/03/22,,,Le slide del Webinar “Il principio DNSH nelle infrastrutture e nei trasporti”,,2022-03-09,https://italiadomani.gov.it,
09/03/22,Presentazioni,,Le slide del Webinar “Il principio DNSH nelle infrastrutture e nei trasporti”,,2022-03-09,https://italiadomani.gov.it,
09/03/22,Altro,Italia,Le slide del Webinar “Il principio DNSH nelle infrastrutture e nei trasporti”,,2022-03-09,https://italiadomani.gov.it,
09/03/22,Presentazioni,,Le slide del Webinar “Il principio DNSH nelle infrastrutture e nei trasporti”,/content/dam/sogei-ng/documenti/DNSH_Modulo%203_Infrastrutture%20e%20trasporti.pptx,2022-03-09,https://italiadomani.gov.it/content/dam/sogei-ng/documenti/DNSH_Modulo%203_Infrastrutture%20e%20trasporti.pptx,
09/03/22,Presentazione,,Le slide del Webinar “Il principio DNSH nelle infrastrutture e nei trasporti”,/content/dam/sogei-ng/documenti/DNSH_Modulo%203_Infrastrutture%20e%20trasporti.pptx,2022-03-09,https://italiadomani.gov.it/content/dam/sogei-ng/documenti/DNSH_Modulo%203_Infrastrutture%20e%20trasporti.pptx,
09/03/22,,,Le slide del Webinar “Il principio DNSH nelle infrastrutture e nei trasporti”,/content/dam/sogei-ng/documenti/DNSH_Modulo%203_Infrastrutture%20e%20trasporti.pptx,2022-03-09,https://italiadomani.gov.it/content/dam/sogei-ng/documenti/DNSH_Modulo%203_Infrastrutture%20e%20trasporti.pptx,
08/03/22,,,Le slide del Webinar “Il principio DNSH nella gestione dei rifiuti”,,2022-03-08,https://italiadomani.gov.it,
08/03/22,Altro,Italia,Le slide del Webinar “Il principio DNSH nella gestione dei rifiuti”,,2022-03-08,https://italiadomani.gov.it,
08/03/22,Presentazioni,,Le slide del Webinar “Il principio DNSH nella gestione dei rifiuti”,,2022-03-08,https://italiadomani.gov.it,
08/03/22,Presentazioni,,Le slide del Webinar “Il principio DNSH nella gestione dei rifiuti”,/content/dam/sogei-ng/documenti/DNSH_Modulo%202_Gestione%20Rifiuti.pptx,2022-03-08,https://italiadomani.gov.it/content/dam/sogei-ng/documenti/DNSH_Modulo%202_Gestione%20Rifiuti.pptx,
08/03/22,Presentazione,,Le slide del Webinar “Il principio DNSH nella gestione dei rifiuti”,/content/dam/sogei-ng/documenti/DNSH_Modulo%202_Gestione%20Rifiuti.pptx,2022-03-08,https://italiadomani.gov.it/content/dam/sogei-ng/documenti/DNSH_Modulo%202_Gestione%20Rifiuti.pptx,
08/03/22,Dati PNRR,,Le slide del Webinar “Il principio DNSH nella gestione dei rifiuti”,/content/dam/sogei-ng/documenti/DNSH_Modulo%202_Gestione%20Rifiuti.pptx,2022-03-08,https://italiadomani.gov.it/content/dam/sogei-ng/documenti/DNSH_Modulo%202_Gestione%20Rifiuti.pptx,
02/03/22,,,Audizione del Min. Cingolani del 15 febbraio 2022 relativa allo stato di attuazione del PNRR,,2022-03-02,https://italiadomani.gov.it,
02/03/22,Altro,Italia,Audizione del Min. Cingolani del 15 febbraio 2022 relativa allo stato di attuazione del PNRR,,2022-03-02,https://italiadomani.gov.it,
02/03/22,Altro,Italia,Audizione del Min. Cingolani del 15 febbraio 2022 relativa allo stato di attuazione del PNRR,/content/dam/sogei-ng/documenti/PNRR%20MiTE_Audizione.pdf,2022-03-02,https://italiadomani.gov.it/content/dam/sogei-ng/documenti/PNRR%20MiTE_Audizione.pdf,
02/03/22,Altro,Italia,Audizione del Min. Cingolani del 15 febbraio 2022 relativa allo stato di attuazione del PNRR,/content/dam/sogei-ng/documenti/PNRR%20MiTE_Audizione.pdf,2022-03-02,https://italiadomani.gov.it/content/dam/sogei-ng/documenti/PNRR%20MiTE_Audizione.pdf,Monitoraggio;Rivoluzione verde e transizione ecologica
02/03/22,,,Audizione del Min. Colao del 23 febbraio 2022 relativa allo stato di attuazione del PNRR,,2022-03-02,https://italiadomani.gov.it,
02/03/22,Altro,Italia,Audizione del Min. Colao del 23 febbraio 2022 relativa allo stato di attuazione del PNRR,,2022-03-02,https://italiadomani.gov.it,
02/03/22,Altro,Italia,Audizione del Min. Colao del 23 febbraio 2022 relativa allo stato di attuazione del PNRR,/content/dam/sogei-ng/documenti/Audizione%20del%20ministro%20Colao_con%20COP.pdf,2022-03-02,https://italiadomani.gov.it/content/dam/sogei-ng/documenti/Audizione%20del%20ministro%20Colao_con%20COP.pdf,
02/03/22,Altro,Italia,Audizione del Min. Colao del 23 febbraio 2022 relativa allo stato di attuazione del PNRR,/content/dam/sogei-ng/documenti/Audizione%20del%20ministro%20Colao_con%20COP.pdf,2022-03-02,https://italiadomani.gov.it/content/dam/sogei-ng/documenti/Audizione%20del%20ministro%20Colao_con%20COP.pdf,Digitalizzazione innovazione competitività cultura e turismo;Monitoraggio
02/03/22,,,Audizione del Min. Giorgetti del 1 marzo 2022 relativa allo stato di attuazione del PNRR,,2022-03-02,https://italiadomani.gov.it,
02/03/22,"Circolari, linee guida",,Audizione del Min. Giorgetti del 1 marzo 2022 relativa allo stato di attuazione del PNRR,,2022-03-02,https://italiadomani.gov.it,
02/03/22,Altro,Italia,Audizione del Min. Giorgetti del 1 marzo 2022 relativa allo stato di attuazione del PNRR,,2022-03-02,https://italiadomani.gov.it,
02/03/22,Altro,Italia,Audizione del Min. Giorgetti del 1 marzo 2022 relativa allo stato di attuazione del PNRR,/content/dam/sogei-ng/documenti/PNRR%20-%20Relazione%20interventi%20MiSE.pdf,2022-03-02,https://italiadomani.gov.it/content/dam/sogei-ng/documenti/PNRR%20-%20Relazione%20interventi%20MiSE.pdf,
02/03/22,Altro,Italia,Audizione del Min. Giorgetti del 1 marzo 2022 relativa allo stato di attuazione del PNRR,/content/dam/sogei-ng/documenti/PNRR%20-%20Relazione%20interventi%20MiSE.pdf,2022-03-02,https://italiadomani.gov.it/content/dam/sogei-ng/documenti/PNRR%20-%20Relazione%20interventi%20MiSE.pdf,Monitoraggio
02/03/22,Altro,Italia,Audizione del ministro Cingolani sullo stato di attuazione del PNRR del 15/02/2022,/content/dam/sogei-ng/documenti/PNRR%20MiTE_Audizione.pdf,2022-03-02,https://italiadomani.gov.it/content/dam/sogei-ng/documenti/PNRR%20MiTE_Audizione.pdf,Monitoraggio;Rivoluzione verde e transizione ecologica
02/03/22,Altro,Italia,Audizione del ministro Colao sullo stato di attuazione del PNRR del 23/02/2022,/content/dam/sogei-ng/documenti/Audizione%20del%20ministro%20Colao_con%20COP.pdf,2022-03-02,https://italiadomani.gov.it/content/dam/sogei-ng/documenti/Audizione%20del%20ministro%20Colao_con%20COP.pdf,Digitalizzazione innovazione competitività cultura e turismo;Monitoraggio
02/03/22,Altro,Italia,Audizione del ministro Giorgetti sullo stato di attuazione del PNRR del 01/03/2022,/content/dam/sogei-ng/documenti/PNRR%20-%20Relazione%20interventi%20MiSE.pdf,2022-03-02,https://italiadomani.gov.it/content/dam/sogei-ng/documenti/PNRR%20-%20Relazione%20interventi%20MiSE.pdf,Monitoraggio
24/02/22,Circolari,Italia,"Circolare RGS sulla rilevazione periodica avvisi, bandi e altre procedure di attivazione degli investimenti”",/content/dam/sogei-ng/documenti/circolare-rgs-sulla-rilevazione-periodica-avvisi-bandi-e-altre-procedure-di-attivazione-degli-investimenti/Circolare_del_29_ottobre_2021_n_25.pdf,2022-02-24,https://italiadomani.gov.it/content/dam/sogei-ng/documenti/circolare-rgs-sulla-rilevazione-periodica-avvisi-bandi-e-altre-procedure-di-attivazione-degli-investimenti/Circolare_del_29_ottobre_2021_n_25.pdf,
24/02/22,Circolari,Italia,Circolare RGS sulla trasmissione delle istruzioni tecniche per la selezione dei progetti,/content/dam/sogei-ng/documenti/circolare-rgs-sulla-trasmissione-delle-istruzioni-tecniche-per-la-selezione-dei-progetti/Circolare-del-14-ottobre-2021-n-21.pdf,2022-02-24,https://italiadomani.gov.it/content/dam/sogei-ng/documenti/circolare-rgs-sulla-trasmissione-delle-istruzioni-tecniche-per-la-selezione-dei-progetti/Circolare-del-14-ottobre-2021-n-21.pdf,
24/02/22,,,"Circolare n.21 del 14.10.2021 ""Trasmissione delle Istruzioni Tecniche per la selezione dei progetti PNRR""",,2022-02-24,https://italiadomani.gov.it,
24/02/22,"Circolari, linee guida",,"Circolare n.21 del 14.10.2021 ""Trasmissione delle Istruzioni Tecniche per la selezione dei progetti PNRR""",,2022-02-24,https://italiadomani.gov.it,
24/02/22,"Circolari, linee guida",,"Circolare n.21 del 14.10.2021 ""Trasmissione delle Istruzioni Tecniche per la selezione dei progetti PNRR""",/content/dam/sogei-ng/documenti/circolare-rgs-sulla-trasmissione-delle-istruzioni-tecniche-per-la-selezione-dei-progetti/Circolare-del-14-ottobre-2021-n-21.pdf,2022-02-24,https://italiadomani.gov.it/content/dam/sogei-ng/documenti/circolare-rgs-sulla-trasmissione-delle-istruzioni-tecniche-per-la-selezione-dei-progetti/Circolare-del-14-ottobre-2021-n-21.pdf,
24/02/22,"Circolari, linee guida",Italia,"Circolare n.21 del 14.10.2021 ""Trasmissione delle Istruzioni Tecniche per la selezione dei progetti PNRR""",/content/dam/sogei-ng/documenti/circolare-rgs-sulla-trasmissione-delle-istruzioni-tecniche-per-la-selezione-dei-progetti/Circolare-del-14-ottobre-2021-n-21.pdf,2022-02-24,https://italiadomani.gov.it/content/dam/sogei-ng/documenti/circolare-rgs-sulla-trasmissione-delle-istruzioni-tecniche-per-la-selezione-dei-progetti/Circolare-del-14-ottobre-2021-n-21.pdf,
24/02/22,"Circolari, Linee Guida",Italia,"Circolare n.21 del 14.10.2021 ""Trasmissione delle Istruzioni Tecniche per la selezione dei progetti PNRR""",/content/dam/sogei-ng/documenti/circolare-rgs-sulla-trasmissione-delle-istruzioni-tecniche-per-la-selezione-dei-progetti/Circolare-del-14-ottobre-2021-n-21.pdf,2022-02-24,https://italiadomani.gov.it/content/dam/sogei-ng/documenti/circolare-rgs-sulla-trasmissione-delle-istruzioni-tecniche-per-la-selezione-dei-progetti/Circolare-del-14-ottobre-2021-n-21.pdf,
24/02/22,,,"Circolare n.25 del 29.10.2021, ""Rilevazione periodica avvisi, bandi e altre procedure di attivazione degli investimenti""",,2022-02-24,https://italiadomani.gov.it,
24/02/22,"Circolari, linee guida",,"Circolare n.25 del 29.10.2021, ""Rilevazione periodica avvisi, bandi e altre procedure di attivazione degli investimenti""",,2022-02-24,https://italiadomani.gov.it,
24/02/22,"Circolari, linee guida",,"Circolare n.25 del 29.10.2021, ""Rilevazione periodica avvisi, bandi e altre procedure di attivazione degli investimenti""",/content/dam/sogei-ng/documenti/circolare-rgs-sulla-rilevazione-periodica-avvisi-bandi-e-altre-procedure-di-attivazione-degli-investimenti/Circolare_del_29_ottobre_2021_n_25.pdf,2022-02-24,https://italiadomani.gov.it/content/dam/sogei-ng/documenti/circolare-rgs-sulla-rilevazione-periodica-avvisi-bandi-e-altre-procedure-di-attivazione-degli-investimenti/Circolare_del_29_ottobre_2021_n_25.pdf,
24/02/22,"Circolari, linee guida",Italia,"Circolare n.25 del 29.10.2021, ""Rilevazione periodica avvisi, bandi e altre procedure di attivazione degli investimenti""",/content/dam/sogei-ng/documenti/circolare-rgs-sulla-rilevazione-periodica-avvisi-bandi-e-altre-procedure-di-attivazione-degli-investimenti/Circolare_del_29_ottobre_2021_n_25.pdf,2022-02-24,https://italiadomani.gov.it/content/dam/sogei-ng/documenti/circolare-rgs-sulla-rilevazione-periodica-avvisi-bandi-e-altre-procedure-di-attivazione-degli-investimenti/Circolare_del_29_ottobre_2021_n_25.pdf,
24/02/22,"Circolari, Linee Guida",Italia,"Circolare n.25 del 29.10.2021, ""Rilevazione periodica avvisi, bandi e altre procedure di attivazione degli investimenti""",/content/dam/sogei-ng/documenti/circolare-rgs-sulla-rilevazione-periodica-avvisi-bandi-e-altre-procedure-di-attivazione-degli-investimenti/Circolare_del_29_ottobre_2021_n_25.pdf,2022-02-24,https://italiadomani.gov.it/content/dam/sogei-ng/documenti/circolare-rgs-sulla-rilevazione-periodica-avvisi-bandi-e-altre-procedure-di-attivazione-degli-investimenti/Circolare_del_29_ottobre_2021_n_25.pdf,
24/02/22,"Circolari, linee guida",,"Circolare n.4 del 18.01.2022, ""Le indicazioni attuative del Pnrr""",,2022-02-24,https://italiadomani.gov.it,
24/02/22,"Circolari, linee guida",,"Circolare n.4 del 18.01.2022, ""Le indicazioni attuative del Pnrr""",/content/dam/sogei-ng/documenti/Circolare-del-18-gennaio-2022-n.-4.pdf,2022-02-24,https://italiadomani.gov.it/content/dam/sogei-ng/documenti/Circolare-del-18-gennaio-2022-n.-4.pdf,
24/02/22,"Circolari, linee guida",Italia,"Circolare n.4 del 18.01.2022, ""Le indicazioni attuative del Pnrr""",/content/dam/sogei-ng/documenti/Circolare-del-18-gennaio-2022-n.-4.pdf,2022-02-24,https://italiadomani.gov.it/content/dam/sogei-ng/documenti/Circolare-del-18-gennaio-2022-n.-4.pdf,
24/02/22,"Circolari, Linee Guida",Italia,"Circolare n.4 del 18.01.2022, ""Le indicazioni attuative del Pnrr""",/content/dam/sogei-ng/documenti/Circolare-del-18-gennaio-2022-n.-4.pdf,2022-02-24,https://italiadomani.gov.it/content/dam/sogei-ng/documenti/Circolare-del-18-gennaio-2022-n.-4.pdf,
24/02/22,"Circolari, linee guida",,"Circolare n.6 del 24.01.2022, ""Servizi di assistenza tecnica per le Amministrazioni titolari di interventi e soggetti attuatori""",,2022-02-24,https://italiadomani.gov.it,
24/02/22,"Circolari, linee guida",,"Circolare n.6 del 24.01.2022, ""Servizi di assistenza tecnica per le Amministrazioni titolari di interventi e soggetti attuatori""",/content/dam/sogei-ng/documenti/circolare-sui-servizi-di-assistenza-tecnica-per-le-amministrazioni-titolari-di-interventi-e-soggetti-attuatori/Circolare-del-24-gennaio-2022-n.-6.pdf,2022-02-24,https://italiadomani.gov.it/content/dam/sogei-ng/documenti/circolare-sui-servizi-di-assistenza-tecnica-per-le-amministrazioni-titolari-di-interventi-e-soggetti-attuatori/Circolare-del-24-gennaio-2022-n.-6.pdf,
24/02/22,"Circolari, linee guida",Italia,"Circolare n.6 del 24.01.2022, ""Servizi di assistenza tecnica per le Amministrazioni titolari di interventi e soggetti attuatori""",/content/dam/sogei-ng/documenti/circolare-sui-servizi-di-assistenza-tecnica-per-le-amministrazioni-titolari-di-interventi-e-soggetti-attuatori/Circolare-del-24-gennaio-2022-n.-6.pdf,2022-02-24,https://italiadomani.gov.it/content/dam/sogei-ng/documenti/circolare-sui-servizi-di-assistenza-tecnica-per-le-amministrazioni-titolari-di-interventi-e-soggetti-attuatori/Circolare-del-24-gennaio-2022-n.-6.pdf,
24/02/22,"Circolari, Linee Guida",Italia,"Circolare n.6 del 24.01.2022, ""Servizi di assistenza tecnica per le Amministrazioni titolari di interventi e soggetti attuatori""",/content/dam/sogei-ng/documenti/circolare-sui-servizi-di-assistenza-tecnica-per-le-amministrazioni-titolari-di-interventi-e-soggetti-attuatori/Circolare-del-24-gennaio-2022-n.-6.pdf,2022-02-24,https://italiadomani.gov.it/content/dam/sogei-ng/documenti/circolare-sui-servizi-di-assistenza-tecnica-per-le-amministrazioni-titolari-di-interventi-e-soggetti-attuatori/Circolare-del-24-gennaio-2022-n.-6.pdf,
24/02/22,"Circolari, linee guida",,"Circolare n.9 del 10.02.2022, ""Trasmissione delle Istruzioni tecniche per la redazione dei sistemi di gestione e controllo delle amministrazioni centrali titolari di interventi""",,2022-02-24,https://italiadomani.gov.it,
24/02/22,"Circolari, linee guida",,"Circolare n.9 del 10.02.2022, ""Trasmissione delle Istruzioni tecniche per la redazione dei sistemi di gestione e controllo delle amministrazioni centrali titolari di interventi""",/content/dam/sogei-ng/documenti/circolare-sulla-trasmissione-delle-istruzioni-tecniche-per-la-redazione-dei-sistemi-di-gestione-e-controllo-delle-amministrazioni-centrali-titolari-di-interventi/Circolare-del-10-febbraio-2022-n-9.pdf,2022-02-24,https://italiadomani.gov.it/content/dam/sogei-ng/documenti/circolare-sulla-trasmissione-delle-istruzioni-tecniche-per-la-redazione-dei-sistemi-di-gestione-e-controllo-delle-amministrazioni-centrali-titolari-di-interventi/Circolare-del-10-febbraio-2022-n-9.pdf,
24/02/22,"Circolari, linee guida",Italia,"Circolare n.9 del 10.02.2022, ""Trasmissione delle Istruzioni tecniche per la redazione dei sistemi di gestione e controllo delle amministrazioni centrali titolari di interventi""",/content/dam/sogei-ng/documenti/circolare-sulla-trasmissione-delle-istruzioni-tecniche-per-la-redazione-dei-sistemi-di-gestione-e-controllo-delle-amministrazioni-centrali-titolari-di-interventi/Circolare-del-10-febbraio-2022-n-9.pdf,2022-02-24,https://italiadomani.gov.it/content/dam/sogei-ng/documenti/circolare-sulla-trasmissione-delle-istruzioni-tecniche-per-la-redazione-dei-sistemi-di-gestione-e-controllo-delle-amministrazioni-centrali-titolari-di-interventi/Circolare-del-10-febbraio-2022-n-9.pdf,
24/02/22,"Circolari, Linee Guida",Italia,"Circolare n.9 del 10.02.2022, ""Trasmissione delle Istruzioni tecniche per la redazione dei sistemi di gestione e controllo delle amministrazioni centrali titolari di interventi""",/content/dam/sogei-ng/documenti/circolare-sulla-trasmissione-delle-istruzioni-tecniche-per-la-redazione-dei-sistemi-di-gestione-e-controllo-delle-amministrazioni-centrali-titolari-di-interventi/Circolare-del-10-febbraio-2022-n-9.pdf,2022-02-24,https://italiadomani.gov.it/content/dam/sogei-ng/documenti/circolare-sulla-trasmissione-delle-istruzioni-tecniche-per-la-redazione-dei-sistemi-di-gestione-e-controllo-delle-amministrazioni-centrali-titolari-di-interventi/Circolare-del-10-febbraio-2022-n-9.pdf,
24/02/22,Circolari,Italia,Circolare recante le indicazioni attuative del Pnrr,/content/dam/sogei-ng/documenti/Circolare-del-18-gennaio-2022-n.-4.pdf,2022-02-24,https://italiadomani.gov.it/content/dam/sogei-ng/documenti/Circolare-del-18-gennaio-2022-n.-4.pdf,
24/02/22,Circolari,Italia,Circolare sui servizi di assistenza tecnica per le Amministrazioni titolari di interventi e soggetti attuatori,/content/dam/sogei-ng/documenti/circolare-sui-servizi-di-assistenza-tecnica-per-le-amministrazioni-titolari-di-interventi-e-soggetti-attuatori/Circolare-del-24-gennaio-2022-n.-6.pdf,2022-02-24,https://italiadomani.gov.it/content/dam/sogei-ng/documenti/circolare-sui-servizi-di-assistenza-tecnica-per-le-amministrazioni-titolari-di-interventi-e-soggetti-attuatori/Circolare-del-24-gennaio-2022-n.-6.pdf,
24/02/22,Circolari,Italia,Circolare sulla trasmissione delle Istruzioni tecniche per la redazione dei sistemi di gestione e controllo delle amministrazioni centrali titolari di interventi,/content/dam/sogei-ng/documenti/circolare-sulla-trasmissione-delle-istruzioni-tecniche-per-la-redazione-dei-sistemi-di-gestione-e-controllo-delle-amministrazioni-centrali-titolari-di-interventi/Circolare-del-10-febbraio-2022-n-9.pdf,2022-02-24,https://italiadomani.gov.it/content/dam/sogei-ng/documenti/circolare-sulla-trasmissione-delle-istruzioni-tecniche-per-la-redazione-dei-sistemi-di-gestione-e-controllo-delle-amministrazioni-centrali-titolari-di-interventi/Circolare-del-10-febbraio-2022-n-9.pdf,
24/02/22,"Circolari, linee guida",,"Nota di chiarimento sulla Circolare n.21 del 14 ottobre 2021 ""Trasmissione delle Istruzioni Tecniche per la selezione dei progetti PNRR - Addizionalità, finanziamento complementare e obbligo di assenza del c.d. doppio finanziamento""",,2022-02-24,https://italiadomani.gov.it,
24/02/22,"Circolari, linee guida",,"Nota di chiarimento sulla Circolare n.21 del 14 ottobre 2021 ""Trasmissione delle Istruzioni Tecniche per la selezione dei progetti PNRR - Addizionalità, finanziamento complementare e obbligo di assenza del c.d. doppio finanziamento""",/content/dam/sogei-ng/documenti/Circolare-del-31-dicembre-2021-n-33.pdf,2022-02-24,https://italiadomani.gov.it/content/dam/sogei-ng/documenti/Circolare-del-31-dicembre-2021-n-33.pdf,
24/02/22,"Circolari, linee guida",Italia,"Nota di chiarimento sulla Circolare n.21 del 14 ottobre 2021 ""Trasmissione delle Istruzioni Tecniche per la selezione dei progetti PNRR - Addizionalità, finanziamento complementare e obbligo di assenza del c.d. doppio finanziamento""",/content/dam/sogei-ng/documenti/Circolare-del-31-dicembre-2021-n-33.pdf,2022-02-24,https://italiadomani.gov.it/content/dam/sogei-ng/documenti/Circolare-del-31-dicembre-2021-n-33.pdf,
24/02/22,"Circolari, Linee Guida",Italia,"Nota di chiarimento sulla Circolare n.21 del 14 ottobre 2021 ""Trasmissione delle Istruzioni Tecniche per la selezione dei progetti PNRR - Addizionalità, finanziamento complementare e obbligo di assenza del c.d. doppio finanziamento""",/content/dam/sogei-ng/documenti/Circolare-del-31-dicembre-2021-n-33.pdf,2022-02-24,https://italiadomani.gov.it/content/dam/sogei-ng/documenti/Circolare-del-31-dicembre-2021-n-33.pdf,
24/02/22,Circolari,Italia,"Nota di chiarimento sulla Circolare ‘Trasmissione delle Istruzioni Tecniche per la selezione dei progetti PNRR – Addizionalità, finanziamento complementare e obbligo di assenza del c.d. doppio finanziamento’",/content/dam/sogei-ng/documenti/Circolare-del-31-dicembre-2021-n-33.pdf,2022-02-24,https://italiadomani.gov.it/content/dam/sogei-ng/documenti/Circolare-del-31-dicembre-2021-n-33.pdf,
17/02/22,Presentazioni,,"Le slide del Webinar ""Il principio DNSH: adempimenti per enti locali e progettisti""",,2022-02-17,https://italiadomani.gov.it,
17/02/22,Presentazioni,,"Le slide del Webinar ""Il principio DNSH: adempimenti per enti locali e progettisti""",/content/dam/sogei-ng/documenti/Slide%20DNSH%200302.pptx,2022-02-17,https://italiadomani.gov.it/content/dam/sogei-ng/documenti/Slide%20DNSH%200302.pptx,
17/02/22,Presentazioni,Italia,Le slide del Webinar ‘Il principio DNSH: adempimenti per enti locali e progettisti’,/content/dam/sogei-ng/documenti/Slide%20DNSH%200302.pptx,2022-02-17,https://italiadomani.gov.it/content/dam/sogei-ng/documenti/Slide%20DNSH%200302.pptx,
17/02/22,Presentazione,Italia,Le slide del Webinar ‘Il principio DNSH: adempimenti per enti locali e progettisti’,/content/dam/sogei-ng/documenti/Slide%20DNSH%200302.pptx,2022-02-17,https://italiadomani.gov.it/content/dam/sogei-ng/documenti/Slide%20DNSH%200302.pptx,
17/02/22,Altro,Italia,Le slide del Webinar ‘Il principio DNSH: adempimenti per enti locali e progettisti’,/content/dam/sogei-ng/documenti/Slide%20DNSH%200302.pptx,2022-02-17,https://italiadomani.gov.it/content/dam/sogei-ng/documenti/Slide%20DNSH%200302.pptx,
17/02/22,Presentazioni,Italia,Le slide del Webinar “Il principio DNSH nei lavori per edificazioni e ristrutturazioni”,,2022-02-17,https://italiadomani.gov.it,
17/02/22,Presentazioni,Italia,Le slide del Webinar “Il principio DNSH nei lavori per edificazioni e ristrutturazioni”,/content/dam/sogei-ng/documenti/DNSH%20-%20Edilizia%201402.pptx,2022-02-17,https://italiadomani.gov.it/content/dam/sogei-ng/documenti/DNSH%20-%20Edilizia%201402.pptx,
17/02/22,Presentazione,Italia,Le slide del Webinar “Il principio DNSH nei lavori per edificazioni e ristrutturazioni”,/content/dam/sogei-ng/documenti/DNSH%20-%20Edilizia%201402.pptx,2022-02-17,https://italiadomani.gov.it/content/dam/sogei-ng/documenti/DNSH%20-%20Edilizia%201402.pptx,
17/02/22,Altro,Italia,Le slide del Webinar “Il principio DNSH nei lavori per edificazioni e ristrutturazioni”,/content/dam/sogei-ng/documenti/DNSH%20-%20Edilizia%201402.pptx,2022-02-17,https://italiadomani.gov.it/content/dam/sogei-ng/documenti/DNSH%20-%20Edilizia%201402.pptx,
11/02/22,Altro,Italia,Accordo tra Mic e Maeci per l’avvio del Progetto ‘Turismo delle Radici’,/content/dam/sogei-ng/documenti/MICMIC_SG_PNRR100220220003816-P.pdf,2022-02-11,https://italiadomani.gov.it/content/dam/sogei-ng/documenti/MICMIC_SG_PNRR100220220003816-P.pdf,Comuni;Cultura;Turismo
11/02/22,Altro,Italia,"Progetto ""Turismo delle Radici"" - accordo tra Mic e Maeci",,2022-02-11,https://italiadomani.gov.it,
11/02/22,Altro,Italia,"Progetto ""Turismo delle Radici"" - accordo tra Mic e Maeci",/content/dam/sogei-ng/documenti/MICMIC_SG_PNRR100220220003816-P.pdf,2022-02-11,https://italiadomani.gov.it/content/dam/sogei-ng/documenti/MICMIC_SG_PNRR100220220003816-P.pdf,
11/02/22,Altro,Italia,"Progetto ""Turismo delle Radici"" - accordo tra Mic e Maeci",/content/dam/sogei-ng/documenti/MICMIC_SG_PNRR100220220003816-P.pdf,2022-02-11,https://italiadomani.gov.it/content/dam/sogei-ng/documenti/MICMIC_SG_PNRR100220220003816-P.pdf,Comuni;Cultura;Turismo
20/01/22,Altro,Italia,Lista esperti e professionisti incaricati dalle Regioni e dalle Province Autonome all’esito delle procedure selettive,,2022-01-20,https://italiadomani.gov.it,
20/01/22,Altro,Italia,Lista esperti e professionisti incaricati dalle Regioni e dalle Province Autonome all’esito delle procedure selettive,/content/dam/sogei-ng/documenti/Lista%20anonimizzata%20esperti%20e%20professionisti.pdf,2022-01-20,https://italiadomani.gov.it/content/dam/sogei-ng/documenti/Lista%20anonimizzata%20esperti%20e%20professionisti.pdf,
20/01/22,Altro,Italia,Lista esperti e professionisti incaricati dalle Regioni e dalle Province Autonome all’esito delle procedure selettive,/content/dam/sogei-ng/documenti/Lista%20anonimizzata%20esperti%20e%20professionisti.pdf,2022-01-20,https://italiadomani.gov.it/content/dam/sogei-ng/documenti/Lista%20anonimizzata%20esperti%20e%20professionisti.pdf,Attuazione;Province Autonome;Regioni
06/01/22,"Circolari, linee guida",Italia,"Linee guida per i contratti pubblici finanziati con le risorse del PNRR e del PNC, volte a favorire le pari opportunità di genere e generazionali e l’inclusione lavorativa delle persone con disabilità.",,2022-01-06,https://italiadomani.gov.it,
06/01/22,"Circolari, linee guida",Italia,"Linee guida per i contratti pubblici finanziati con le risorse del PNRR e del PNC, volte a favorire le pari opportunità di genere e generazionali e l’inclusione lavorativa delle persone con disabilità.",/content/dam/sogei-ng/documenti/Decreto%20interministeriale%20del%207%20dicembre%20contenente%20le%20linee%20guida%20sulle%20pari%20opportunità.pdf,2022-01-06,https://italiadomani.gov.it/content/dam/sogei-ng/documenti/Decreto%20interministeriale%20del%207%20dicembre%20contenente%20le%20linee%20guida%20sulle%20pari%20opportunità.pdf,
06/01/22,"Circolari, linee guida",Italia,"Linee guida per i contratti pubblici finanziati con le risorse del PNRR e del PNC, volte a favorire le pari opportunità di genere e generazionali e l’inclusione lavorativa delle persone con disabilità.",/content/dam/sogei-ng/documenti/Decreto%20interministeriale%20del%207%20dicembre%20contenente%20le%20linee%20guida%20sulle%20pari%20opportunità.pdf,2022-01-06,https://italiadomani.gov.it/content/dam/sogei-ng/documenti/Decreto%20interministeriale%20del%207%20dicembre%20contenente%20le%20linee%20guida%20sulle%20pari%20opportunità.pdf,Inclusione e coesione
06/01/22,Decreti e Regolamenti,Italia,Linee guida volte a favorire le pari opportunità di genere e generazionali e l’inclusione lavorativa delle persone con disabilità nei contratti pubblici finanziati con le risorse del PNRR e del PNC,/content/dam/sogei-ng/documenti/Decreto%20interministeriale%20del%207%20dicembre%20contenente%20le%20linee%20guida%20sulle%20pari%20opportunità.pdf,2022-01-06,https://italiadomani.gov.it/content/dam/sogei-ng/documenti/Decreto%20interministeriale%20del%207%20dicembre%20contenente%20le%20linee%20guida%20sulle%20pari%20opportunità.pdf,Inclusione e coesione
06/01/22,Decreti e Regolamenti,Italia,Linee guida volte a favorire le pari opportunità di genere e generazionali e l’inclusione lavorativa delle persone con disabilità nei contratti pubblici finanziati con le risorse del PNRR e del PNC,/content/dam/sogei-ng/documenti/GU%20Serie%20Generale%20n.309%20del%2030-12-2021.pdf,2022-01-06,https://italiadomani.gov.it/content/dam/sogei-ng/documenti/GU%20Serie%20Generale%20n.309%20del%2030-12-2021.pdf,Inclusione e coesione
05/01/22,Decreti amministrativi e regolamenti,Italia,M6C2-4 Piano di riorganizzazione delle strutture ospedalierie per l'emergenza pandemica,,2022-01-05,https://italiadomani.gov.it,
05/01/22,Decreti amministrativi e regolamenti,Italia,M6C2-4 Piano di riorganizzazione delle strutture ospedalierie per l'emergenza pandemica,/content/dam/sogei-ng/documenti/2-Piano-Riorganizzazione-TI-e-TSI-20_10_2021_v02.pdf,2022-01-05,https://italiadomani.gov.it/content/dam/sogei-ng/documenti/2-Piano-Riorganizzazione-TI-e-TSI-20_10_2021_v02.pdf,
05/01/22,Altro,Italia,Piano di riorganizzazione delle strutture sanitarie per l'emergenza pandemica,/content/dam/sogei-ng/documenti/2-Piano-Riorganizzazione-TI-e-TSI-20_10_2021_v02.pdf,2022-01-05,https://italiadomani.gov.it/content/dam/sogei-ng/documenti/2-Piano-Riorganizzazione-TI-e-TSI-20_10_2021_v02.pdf,
05/01/22,Decreti amministrativi e regolamenti,,Regolamento sulle modalità di digitalizzazione delle procedure dei contratti pubblici,,2022-01-05,https://italiadomani.gov.it,
05/01/22,Decreti amministrativi e regolamenti,Italia,Regolamento sulle modalità di digitalizzazione delle procedure dei contratti pubblici,,2022-01-05,https://italiadomani.gov.it,
05/01/22,Decreti amministrativi e regolamenti,Italia,Regolamento sulle modalità di digitalizzazione delle procedure dei contratti pubblici,/content/dam/sogei-ng/documenti/Decreto_Ministeriale_12_agosto%20202_%20n_148.pdf,2022-01-05,https://italiadomani.gov.it/content/dam/sogei-ng/documenti/Decreto_Ministeriale_12_agosto%20202_%20n_148.pdf,
05/01/22,Decreti amministrativi e regolamenti,Italia,Regolamento sulle modalità di digitalizzazione delle procedure dei contratti pubblici,/content/dam/sogei-ng/documenti/Decreto_Ministeriale_12_agosto%20202_%20n_148.pdf,2022-01-05,https://italiadomani.gov.it/content/dam/sogei-ng/documenti/Decreto_Ministeriale_12_agosto%20202_%20n_148.pdf,Pubblica Amministrazione
05/01/22,Decreti e Regolamenti,Italia,Regolamento sulle modalità di digitalizzazione delle procedure dei contratti pubblici,/content/dam/sogei-ng/documenti/Decreto_Ministeriale_12_agosto%20202_%20n_148.pdf,2022-01-05,https://italiadomani.gov.it/content/dam/sogei-ng/documenti/Decreto_Ministeriale_12_agosto%20202_%20n_148.pdf,Digital;Pubblica Amministrazione
04/01/22,Altro,Italia,Allegato 1: Comunicazione delle politiche di investimento Cassa Depositi e Prestiti,/content/dam/sogei-ng/documenti/Allegato%201_CDPI%20SGR_Comunicazione-politiche-di-investimento.pdf,2022-01-04,https://italiadomani.gov.it/content/dam/sogei-ng/documenti/Allegato%201_CDPI%20SGR_Comunicazione-politiche-di-investimento.pdf,
04/01/22,Altro,Italia,Allegato 3c: Manuale utente - Tourism Digital Hub – Dashboard,/content/dam/sogei-ng/documenti/Allegato%203c-Dashboard-Manuale-Utente.pdf,2022-01-04,https://italiadomani.gov.it/content/dam/sogei-ng/documenti/Allegato%203c-Dashboard-Manuale-Utente.pdf,
04/01/22,Altro,Italia,Allegato 4: Comunicazione integrativa delle politiche di investimento Cassa Depositi e Prestiti,/content/dam/sogei-ng/documenti/Allegato%204_CDPI%20SGR_Comunicazione-integrativa-politiche-di-investimento.pdf,2022-01-04,https://italiadomani.gov.it/content/dam/sogei-ng/documenti/Allegato%204_CDPI%20SGR_Comunicazione-integrativa-politiche-di-investimento.pdf,
04/01/22,Altro,Italia,"Allegato 5: Comunicazione referenti tavoli tematici avente oggetto “Collaborazione e partecipazione per il Tourism Digital Hub nell’ambito del PNRR""",/content/dam/sogei-ng/documenti/Allegato-5-Nota-comunicazione-referenti-tavoli-tematici.pdf,2022-01-04,https://italiadomani.gov.it/content/dam/sogei-ng/documenti/Allegato-5-Nota-comunicazione-referenti-tavoli-tematici.pdf,
04/01/22,"Circolari, linee guida",Italia,CIRCOLARE n.11254 del 29.05.2020 “Linee di indirizzo organizzative per il potenziamento della rete ospedaliera per emergenza Covid-19”,/content/dam/sogei-ng/documenti/Min-Sal-circolare-11254_potenziamento-rete-ospedaliera_29-mag-20.pdf,2022-01-04,https://italiadomani.gov.it/content/dam/sogei-ng/documenti/Min-Sal-circolare-11254_potenziamento-rete-ospedaliera_29-mag-20.pdf,
04/01/22,Altro,Italia,Circolare n.11254 del 29 maggio 2020,/content/dam/sogei-ng/documenti/Min-Sal-circolare-11254_potenziamento-rete-ospedaliera_29-mag-20.pdf,2022-01-04,https://italiadomani.gov.it/content/dam/sogei-ng/documenti/Min-Sal-circolare-11254_potenziamento-rete-ospedaliera_29-mag-20.pdf,
04/01/22,"Circolari, linee guida",,Circolare n.11254 del 29.05.2020 “Linee di indirizzo organizzative per il potenziamento della rete ospedaliera per emergenza Covid-19”,,2022-01-04,https://italiadomani.gov.it,
04/01/22,"Circolari, linee guida",,Circolare n.11254 del 29.05.2020 “Linee di indirizzo organizzative per il potenziamento della rete ospedaliera per emergenza Covid-19”,/content/dam/sogei-ng/documenti/Min-Sal-circolare-11254_potenziamento-rete-ospedaliera_29-mag-20.pdf,2022-01-04,https://italiadomani.gov.it/content/dam/sogei-ng/documenti/Min-Sal-circolare-11254_potenziamento-rete-ospedaliera_29-mag-20.pdf,
04/01/22,Altro,Italia,Documentazione della misura M1C1-23 – Fondi integrati per la competitività delle imprese turistiche,/content/dam/sogei-ng/documenti/Allegato%201_CDPI%20SGR_Comunicazione-politiche-di-investimento.pdf,2022-01-04,https://italiadomani.gov.it/content/dam/sogei-ng/documenti/Allegato%201_CDPI%20SGR_Comunicazione-politiche-di-investimento.pdf,
04/01/22,Altro,Italia,Documentazione della misura M1C3-8 - Hub del turismo digitale,/content/dam/sogei-ng/documenti/Allegato%203c-Dashboard-Manuale-Utente.pdf,2022-01-04,https://italiadomani.gov.it/content/dam/sogei-ng/documenti/Allegato%203c-Dashboard-Manuale-Utente.pdf,
04/01/22,"Circolari, linee guida",Italia,Linee di indirizzo organizzative per il potenziamento della rete ospedaliera per emergenza COVID-19,,2022-01-04,https://italiadomani.gov.it,
04/01/22,"Circolari, linee guida",Italia,Linee di indirizzo organizzative per il potenziamento della rete ospedaliera per emergenza COVID-19,/content/dam/sogei-ng/documenti/Allegato-1-Circolare-DGPROGS-DGRUPS-29-5-20-Linee-guida.pdf,2022-01-04,https://italiadomani.gov.it/content/dam/sogei-ng/documenti/Allegato-1-Circolare-DGPROGS-DGRUPS-29-5-20-Linee-guida.pdf,
04/01/22,Altro,Italia,Linee di indirizzo organizzative per il potenziamento della rete ospedaliera per emergenza COVID-19,/content/dam/sogei-ng/documenti/Allegato-1-Circolare-DGPROGS-DGRUPS-29-5-20-Linee-guida.pdf,2022-01-04,https://italiadomani.gov.it/content/dam/sogei-ng/documenti/Allegato-1-Circolare-DGPROGS-DGRUPS-29-5-20-Linee-guida.pdf,
04/01/22,Altro,,"M1C1-23 - Investimento 4.2 - ""Fondi integrati per la competitività delle imprese turistiche"" - Documentazione relativa alla misura",,2022-01-04,https://italiadomani.gov.it,
04/01/22,Altro,,"M1C1-23 - Investimento 4.2 - ""Fondi integrati per la competitività delle imprese turistiche"" - Documentazione relativa alla misura",/content/dam/sogei-ng/documenti/Allegato%201_CDPI%20SGR_Comunicazione-politiche-di-investimento.pdf,2022-01-04,https://italiadomani.gov.it/content/dam/sogei-ng/documenti/Allegato%201_CDPI%20SGR_Comunicazione-politiche-di-investimento.pdf,
04/01/22,Altro,Italia,"M1C1-23 - Investimento 4.2 - ""Fondi integrati per la competitività delle imprese turistiche"" - Documentazione relativa alla misura",/content/dam/sogei-ng/documenti/Allegato%201_CDPI%20SGR_Comunicazione-politiche-di-investimento.pdf,2022-01-04,https://italiadomani.gov.it/content/dam/sogei-ng/documenti/Allegato%201_CDPI%20SGR_Comunicazione-politiche-di-investimento.pdf,
04/01/22,Altro,,"M1C3-8 - Investimento 4.1 - ""Hub del turismo digitale"" - Documentazione relativa alla misura",,2022-01-04,https://italiadomani.gov.it,
04/01/22,Altro,,"M1C3-8 - Investimento 4.1 - ""Hub del turismo digitale"" - Documentazione relativa alla misura",/content/dam/sogei-ng/documenti/Allegato%203c-Dashboard-Manuale-Utente.pdf,2022-01-04,https://italiadomani.gov.it/content/dam/sogei-ng/documenti/Allegato%203c-Dashboard-Manuale-Utente.pdf,
04/01/22,Altro,Italia,"M1C3-8 - Investimento 4.1 - ""Hub del turismo digitale"" - Documentazione relativa alla misura",/content/dam/sogei-ng/documenti/Allegato%203c-Dashboard-Manuale-Utente.pdf,2022-01-04,https://italiadomani.gov.it/content/dam/sogei-ng/documenti/Allegato%203c-Dashboard-Manuale-Utente.pdf,
04/01/22,Altro,,"M6C2 ""Riordino della rete ospedaliera in emergenza COVID-19 _Dotazione posti letto"" - Manuale utente",,2022-01-04,https://italiadomani.gov.it,
04/01/22,Altro,,"M6C2 ""Riordino della rete ospedaliera in emergenza COVID-19 _Dotazione posti letto"" - Manuale utente",/content/dam/sogei-ng/documenti/Allegato-2-Circolare-DGPROGS-DGRUPS-29-5-20-MANUALE-UTENTE-REGIONE.pdf,2022-01-04,https://italiadomani.gov.it/content/dam/sogei-ng/documenti/Allegato-2-Circolare-DGPROGS-DGRUPS-29-5-20-MANUALE-UTENTE-REGIONE.pdf,
04/01/22,Altro,Italia,"M6C2 ""Riordino della rete ospedaliera in emergenza COVID-19 _Dotazione posti letto"" - Manuale utente",/content/dam/sogei-ng/documenti/Allegato-2-Circolare-DGPROGS-DGRUPS-29-5-20-MANUALE-UTENTE-REGIONE.pdf,2022-01-04,https://italiadomani.gov.it/content/dam/sogei-ng/documenti/Allegato-2-Circolare-DGPROGS-DGRUPS-29-5-20-MANUALE-UTENTE-REGIONE.pdf,
04/01/22,Altro,Italia,Manuale Utente - Riordino della rete ospedaliera in emergenza COVID-19 – Dotazione posti letto,/content/dam/sogei-ng/documenti/Allegato-2-Circolare-DGPROGS-DGRUPS-29-5-20-MANUALE-UTENTE-REGIONE.pdf,2022-01-04,https://italiadomani.gov.it/content/dam/sogei-ng/documenti/Allegato-2-Circolare-DGPROGS-DGRUPS-29-5-20-MANUALE-UTENTE-REGIONE.pdf,
31/12/21,Decreti amministrativi e regolamenti,Italia,"D.M. MUR n.1320 del 17.12.2021 ""Incremento del valore delle borse di studio e requisiti di eleggibilità""",/content/dam/sogei-ng/documenti/doc-31-12/D.M_1320_17.12.2021.pdf,2021-12-31,https://italiadomani.gov.it/content/dam/sogei-ng/documenti/doc-31-12/D.M_1320_17.12.2021.pdf,
31/12/21,Decreti amministrativi e regolamenti,Italia,DPCM del 23.12.2021 di approvazione Programma di controllo dell’inquinamento atmosferico,/content/dam/sogei-ng/documenti/doc-31-12/DPCM%20inquinamento%20atmosferico.pdf,2021-12-31,https://italiadomani.gov.it/content/dam/sogei-ng/documenti/doc-31-12/DPCM%20inquinamento%20atmosferico.pdf,
31/12/21,Decreti e Regolamenti,Italia,DPCM di approvazione Programma di controllo dell’inquinamento atmosferico del 23.12.2021,/content/dam/sogei-ng/documenti/doc-31-12/DPCM%20inquinamento%20atmosferico.pdf,2021-12-31,https://italiadomani.gov.it/content/dam/sogei-ng/documenti/doc-31-12/DPCM%20inquinamento%20atmosferico.pdf,
31/12/21,Decreti e Regolamenti,Italia,DPR Sportello Unico Doganale e dei Controlli,/content/dam/sogei-ng/documenti/doc-31-12/DPR%20SUDOCO.pdf,2021-12-31,https://italiadomani.gov.it/content/dam/sogei-ng/documenti/doc-31-12/DPR%20SUDOCO.pdf,
31/12/21,Decreti e Regolamenti,Italia,Decreto Ministeriale 1320 del 17.12.2021,/content/dam/sogei-ng/documenti/doc-31-12/D.M_1320_17.12.2021.pdf,2021-12-31,https://italiadomani.gov.it/content/dam/sogei-ng/documenti/doc-31-12/D.M_1320_17.12.2021.pdf,
31/12/21,Decreti e Regolamenti,Italia,Decreto del 24.11.2021 di adozione del fondo a sostegno dell’imprenditorialità femminile,/content/dam/sogei-ng/documenti/doc-31-12/Decreto%20del%2024.11.2021%20imprenditorialita%20femminile.pdf,2021-12-31,https://italiadomani.gov.it/content/dam/sogei-ng/documenti/doc-31-12/Decreto%20del%2024.11.2021%20imprenditorialita%20femminile.pdf,
31/12/21,Circolari,Italia,Documentazione della misura M1C1-26 - Investimento 5.1: Rifinanziamento e ridefinizione del Fondo 394/81 gestito da SIMEST,/content/dam/sogei-ng/documenti/circolare-1---pnrr-394-2021---transizione-digitale-ed-ecologica.pdf,2021-12-31,https://italiadomani.gov.it/content/dam/sogei-ng/documenti/circolare-1---pnrr-394-2021---transizione-digitale-ed-ecologica.pdf,
31/12/21,Circolari,Italia,Fondo 394/81 - Circolare n. 1/PNRR/394/2021,/content/dam/sogei-ng/documenti/circolare-1---pnrr-394-2021---transizione-digitale-ed-ecologica.pdf,2021-12-31,https://italiadomani.gov.it/content/dam/sogei-ng/documenti/circolare-1---pnrr-394-2021---transizione-digitale-ed-ecologica.pdf,
31/12/21,Circolari,Italia,Fondo 394/81 - Circolare n. 2/PNRR/394/2021,/content/dam/sogei-ng/documenti/Allegato-3-pnrr-394-2021-ecommerce.pdf,2021-12-31,https://italiadomani.gov.it/content/dam/sogei-ng/documenti/Allegato-3-pnrr-394-2021-ecommerce.pdf,
31/12/21,Circolari,Italia,Fondo 394/81 - Circolare n. 3/PNRR/394/2021,/content/dam/sogei-ng/documenti/circolare-3---pnrr-394-2021---fiere-e-mostre.pdf,2021-12-31,https://italiadomani.gov.it/content/dam/sogei-ng/documenti/circolare-3---pnrr-394-2021---fiere-e-mostre.pdf,
31/12/21,Altro,Italia,Relazione per orientare le azioni di governo volte a ridurre l’Evasione fiscale derivante da omessa fatturazione,/content/dam/sogei-ng/documenti/Relazione-per-orientare-le-azioni-di-governo-volte-a-ridurre-l-Evasione-fiscale-derivante-da-omessa-fatturazione.pdf,2021-12-31,https://italiadomani.gov.it/content/dam/sogei-ng/documenti/Relazione-per-orientare-le-azioni-di-governo-volte-a-ridurre-l-Evasione-fiscale-derivante-da-omessa-fatturazione.pdf,
30/12/21,Dati PNRR e Piano Complementare,Italia,Base giuridica del Piano Nazionale Complementare,/content/dam/sogei-ng/documenti/DL06-05-2021_n59.pdf,2021-12-30,https://italiadomani.gov.it/content/dam/sogei-ng/documenti/DL06-05-2021_n59.pdf,Fondo Complementare
30/12/21,Decreti e Regolamenti,Italia,Guida operativa Do No Significant Harm (DNSH),/content/dam/sogei-ng/dnsh/doc-guida-operativa/20211221_Guida%20operativa%20del%20principio%20DNSH.pdf,2021-12-30,https://italiadomani.gov.it/content/dam/sogei-ng/dnsh/doc-guida-operativa/20211221_Guida%20operativa%20del%20principio%20DNSH.pdf,Green;Investimenti
30/12/21,Altro,Italia,I Piani territoriali delle Regioni,/content/dam/sogei-ng/documenti/piano_territoriale_v1/Abruzzo.pdf,2021-12-30,https://italiadomani.gov.it/content/dam/sogei-ng/documenti/piano_territoriale_v1/Abruzzo.pdf,Attuazione;Enti Locali
30/12/21,Dati PNRR e Piano Complementare,Italia,Report sugli adempimenti e le attività del PNC,/content/dam/sogei-ng/documenti/documentazione-pnc/PNC%20-%20report%2030%20settembre%202021.pdf,2021-12-30,https://italiadomani.gov.it/content/dam/sogei-ng/documenti/documentazione-pnc/PNC%20-%20report%2030%20settembre%202021.pdf,Fondo Complementare
28/12/21,Altro,Italia,Contributi delle amministrazioni alla Relazione al Parlamento sullo stato di attuazione del Piano Nazionale di Ripresa e Resilienza,/content/dam/sogei-ng/documenti/contributo--del-ministero-delle-infrastrutture-e-della-mobilità-sostenibili--alla-relazione-al-parlamento-sullo-stato-di-attuazione-del-piano-nazionale-di-ripresa-e-resilienza/1_PNRR_MIMS.pdf,2021-12-28,https://italiadomani.gov.it/content/dam/sogei-ng/documenti/contributo--del-ministero-delle-infrastrutture-e-della-mobilità-sostenibili--alla-relazione-al-parlamento-sullo-stato-di-attuazione-del-piano-nazionale-di-ripresa-e-resilienza/1_PNRR_MIMS.pdf,Attuazione;Investimenti;Milestone;Monitoraggio;Obiettivi;Open Data;Piano di Ripresa e Resilienza;Recovery Fund;Rendicontazione;Riforme;Target;Traguardi
28/12/21,Altro,Italia,Contributo [del Ministero delle Infrastrutture e della Mobilità Sostenibili] alla Relazione al Parlamento sullo stato di attuazione del Piano Nazionale di Ripresa e Resilienza,/content/dam/sogei-ng/documenti/contributo--del-ministero-delle-infrastrutture-e-della-mobilità-sostenibili--alla-relazione-al-parlamento-sullo-stato-di-attuazione-del-piano-nazionale-di-ripresa-e-resilienza/1_PNRR_MIMS.pdf,2021-12-28,https://italiadomani.gov.it/content/dam/sogei-ng/documenti/contributo--del-ministero-delle-infrastrutture-e-della-mobilità-sostenibili--alla-relazione-al-parlamento-sullo-stato-di-attuazione-del-piano-nazionale-di-ripresa-e-resilienza/1_PNRR_MIMS.pdf,Attuazione;Investimenti;Milestone;Monitoraggio;Obiettivi;Open Data;Piano di Ripresa e Resilienza;Recovery Fund;Rendicontazione;Riforme;Target;Traguardi
23/12/21,Altro,Italia,Relazione al Parlamento sullo stato di attuazione del Piano Nazionale di Ripresa e Resilienza,/content/dam/sogei-ng/documenti/23.12.21%20Relazione%20al%20Parlamento%20sullo%20stato%20di%20attuazione%20del%20Piano%20Nazionale%20di%20Ripresa%20e%20Resilienza_def.pdf,2021-12-23,https://italiadomani.gov.it/content/dam/sogei-ng/documenti/23.12.21%20Relazione%20al%20Parlamento%20sullo%20stato%20di%20attuazione%20del%20Piano%20Nazionale%20di%20Ripresa%20e%20Resilienza_def.pdf,Attuazione;Investimenti;Milestone;Monitoraggio;Obiettivi;Open Data;Piano di Ripresa e Resilienza;Recovery Fund;Rendicontazione;Riforme;Target;Traguardi
23/12/21,Altro,Italia,Relazione al Parlamento sullo stato di attuazione del Piano Nazionale di Ripresa e Resilienza,/content/dam/sogei-ng/documenti/Relazione%20al%20Parlamento%20sullo%20stato%20di%20attuazione%20del%20Piano%20Nazionale%20di%20Ripresa%20e%20Resilienza.pdf,2021-12-23,https://italiadomani.gov.it/content/dam/sogei-ng/documenti/Relazione%20al%20Parlamento%20sullo%20stato%20di%20attuazione%20del%20Piano%20Nazionale%20di%20Ripresa%20e%20Resilienza.pdf,Attuazione;Investimenti;Milestone;Monitoraggio;Obiettivi;Open Data;Piano di Ripresa e Resilienza;Recovery Fund;Rendicontazione;Riforme;Target;Traguardi
23/12/21,Altro,Italia,Relazione al Parlamento sullo stato di attuazione del Piano Nazionale di Ripresa e Resilienza,/content/dam/sogei-ng/documenti/Relazione%20al%20Parlamento%20sullo%20stato%20di%20attuazione%20del%20Piano%20Nazionale%20di%20Ripresa%20e%20Resilienza.pdf,2021-12-23,https://italiadomani.gov.it/content/dam/sogei-ng/documenti/Relazione%20al%20Parlamento%20sullo%20stato%20di%20attuazione%20del%20Piano%20Nazionale%20di%20Ripresa%20e%20Resilienza.pdf,Attuazione;Investimenti;Monitoraggio;Obiettivi;Piano di Ripresa e Resilienza;Recovery Fund;Rendicontazione;Riforme;Traguardi;Open Data;Target;Milestone
23/11/21,Decreti e Regolamenti,Italia,"DPCM su modalità, tempistiche e strumenti per la rilevazione dei dati – 15 settembre 2021",/content/dam/sogei-ng/documenti/DPCM-15%20sett%202021%20Rilevazione%20dei%20Dati%20di%20Attuazione%20Finanziaria%20Fisica%20e%20Procedurale%20per%20singolo%20progetto%20del%20PNRR.pdf,2021-11-23,https://italiadomani.gov.it/content/dam/sogei-ng/documenti/DPCM-15%20sett%202021%20Rilevazione%20dei%20Dati%20di%20Attuazione%20Finanziaria%20Fisica%20e%20Procedurale%20per%20singolo%20progetto%20del%20PNRR.pdf,Attuazione;Linee Guida;Monitoraggio
23/11/21,Decreti e Regolamenti,Italia,"DPCM su modalità, tempistiche e strumenti per la rilevazione dei dati – 15 settembre 2021",/content/dam/sogei-ng/documenti/DPCM-15%20sett%202021%20Rilevazione%20dei%20Dati%20di%20Attuazione%20Finanziaria%20Fisica%20e%20Procedurale%20per%20singolo%20progetto%20del%20PNRR.pdf,2021-11-23,https://italiadomani.gov.it/content/dam/sogei-ng/documenti/DPCM-15%20sett%202021%20Rilevazione%20dei%20Dati%20di%20Attuazione%20Finanziaria%20Fisica%20e%20Procedurale%20per%20singolo%20progetto%20del%20PNRR.pdf,Monitoraggio;Attuazione;Linee Guida
19/11/21,Altro,Italia,Le slide dell'iniziativa 'I Comuni e le Città nel Pnrr: le risorse e le sfide’,/content/dam/sogei-ng/documenti/COMUNI%20E%20LE%20CITTÀ%20NEL%20PNRR.pptx,2021-11-19,https://italiadomani.gov.it/content/dam/sogei-ng/documenti/COMUNI%20E%20LE%20CITTÀ%20NEL%20PNRR.pptx,Attuazione;Enti Locali;Green;Presentazioni;Province;Regioni
19/11/21,Altro,Italia,Le slide dell'iniziativa 'I Comuni e le Città nel Pnrr: le risorse e le sfide’,/content/dam/sogei-ng/documenti/COMUNI%20E%20LE%20CITTÀ%20NEL%20PNRR_def%20(2).pptx,2021-11-19,https://italiadomani.gov.it/content/dam/sogei-ng/documenti/COMUNI%20E%20LE%20CITTÀ%20NEL%20PNRR_def%20(2).pptx,Green;Digital;Attuazione;Enti Locali;Regioni;Province;Presentazioni
29/10/21,Circolari,Italia,Modulo per comunicazione di Bandi e Avvisi da parte di Amministrazioni Titolari,/content/dam/sogei-ng/documenti/Bandi_PNRR-controllo_dati-1029.docx,2021-10-29,https://italiadomani.gov.it/content/dam/sogei-ng/documenti/Bandi_PNRR-controllo_dati-1029.docx,Attuazione;Investimenti;Bandi e Avvisi
